S/N,Title,Images,Shelflist,Position,Author,Category,SubCategory,Publisher,Description,Tags
3786,Homecoming,https://lotuscommunity.org.vn/wp-content/uploads/2021/10/Homecoming.jpg,32-2,021,Diana Gallagher,Sách truyện người lớn,Thực tế,Stone Arch Books,"It's homecoming week, but everything is going wrong.",Từ 13 tuổi trở lên
3817,Horrible histories: cruel crime,https://lotuscommunity.org.vn/wp-content/uploads/2021/10/Horrible-histories-cruel-crime.jpg,28-3,051,Terry Deary,Sách về cách sống,Hài hước,Scholastic,"Readers can discover all the facts about cruel, crime, including who was sentenced to death - by coffee. Where you could be whipped for flying a kite and why a cockerel was burnt at the stake. Previously publishing in large format as cruel crime and painful punishment. ",Từ 13 tuổi trở lên
3828,Horrible science: shocking electricity,https://lotuscommunity.org.vn/wp-content/uploads/2021/10/Horrible-science-shocking-electricity.jpg,28-3,006,Nick Arnold,Sách về cách sống,Hài hước,Scholastic,"Are you buzzing to discover how an electric eel can give you a nasty shock?; why electricity keeps your heart beating?; or which scientist gave electric shocks to his eyeballs? Using fact files and quizzes, teacher tests and cartoons, discover the shocking facts about electricity.",Từ 13 tuổi trở lên
3832,Horribly famous: Elvis and the blue suede shoes,https://lotuscommunity.org.vn/wp-content/uploads/2021/10/Horribly-famous-Elvis-and-the-blue-suede-shoes.jpg,28-3,079,Michael Cox,Sách về cách sống,Hài hước,Scholastic,"Everybody's heard of Elvis Presley. He is horribly famous for being the King of Rock 'n' Roll, having trouble fitting into his spangly white jumpsuits and causing a riot with a wiggle of his pelvis. But not everyone knows that Elvis escaped from tornadoes by hiding in a cave, flew halfway across America for 22 giant sandwiches and had a tooth stuck in his lung...Everything you ever wanted to know about the man with the pelvis.",Từ 13 tuổi trở lên
3833,Horribly famous: Elvis and the blue suede shoes,https://lotuscommunity.org.vn/wp-content/uploads/2021/10/Horribly-famous-Elvis-and-the-blue-suede-shoes.jpg,28-3,078,Michael Cox,Sách về cách sống,Hài hước,Scholastic,"Everybody's heard of Elvis Presley. He is horribly famous for being the King of Rock 'n' Roll, having trouble fitting into his spangly white jumpsuits and causing a riot with a wiggle of his pelvis. But not everyone knows that Elvis escaped from tornadoes by hiding in a cave, flew halfway across America for 22 giant sandwiches and had a tooth stuck in his lung...Everything you ever wanted to know about the man with the pelvis.",Từ 13 tuổi trở lên
3834,Horribly famous: Elvis and the blue suede shoes,https://lotuscommunity.org.vn/wp-content/uploads/2021/10/Horribly-famous-Elvis-and-the-blue-suede-shoes.jpg,28-3,076,Michael Cox,Sách về cách sống,Hài hước,Scholastic,"Everybody's heard of Elvis Presley. He is horribly famous for being the King of Rock 'n' Roll, having trouble fitting into his spangly white jumpsuits and causing a riot with a wiggle of his pelvis. But not everyone knows that Elvis escaped from tornadoes by hiding in a cave, flew halfway across America for 22 giant sandwiches and had a tooth stuck in his lung...Everything you ever wanted to know about the man with the pelvis.",Từ 13 tuổi trở lên
3884,Hour of the bees,https://lotuscommunity.org.vn/wp-content/uploads/2021/10/Hour-of-the-bees.jpg,33-4,061,Lindsay Eagar,Sách truyện người lớn,Phiêu lưu,Walker Books,"While her friends are spending their summers having pool parties and sleepovers, twelve-year-old Carolina - Carol - is spending hers in the New Mexico desert, helping her parents move her grandfather into a home for people with dementia. At first, Carol avoids prickly Grandpa Serge. But as the summer wears on, Carol finds herself drawn to him, fascinated by the crazy stories he tells her about a healing tree, a green-glass lake, and the bees that will bring back the rain and end a hundred years of drought. As the line between magic and reality starts to blur, Carol must decide for herself what is possible - and what it means to be true to her roots.",Từ 13 tuổi trở lên
3898,How artists see animals,https://lotuscommunity.org.vn/wp-content/uploads/2021/10/How-artists-see-animals.jpg,31-3,055,Colleen Carroll,Sách về sở thích,Vẽ và màu,Abbeville Kids ,In How Artists See Animals children can see how Franz Marc transformed an ordinary cow into a magical one by using brilliant colors; how Roy Lichtenstein created goldfish out of metal; how John James Audubon depicted the elegance of a flamingo in its natural environment; and how Robert Jew made an iguana look so real that it seems about to crawl off its canvas.,Từ 13 tuổi trở lên
3956,How I stole Johnny Depp's alien girlfriend,https://lotuscommunity.org.vn/wp-content/uploads/2021/10/How-I-stole-Johnny-Depp_s-alien-girlfriend.jpg,32-2,012,Gary Ghislain,Sách truyện người lớn,Lãng mạn,Chronicle Books,"David Gershwin's summer is about to take a turn for the weird. When his dad's new patient Zelda tells him shes from outer space and on a quest to take Johnny Depp back to her planet, he knows he should run away screaming. But with one look from her mean, green eyes, David's hooked, and soon he's leaping across rooftops, running from police, and stealing cars just to stay by her side. He might not be a typical hero, but David's going to get the girl even if it takes him to the ends of the earthor beyond.",Từ 13 tuổi trở lên
3998,How to draw cartoons,https://lotuscommunity.org.vn/wp-content/uploads/2021/10/How-to-draw-cartoons.jpg,31-3,018,David Antram,Sách về sở thích,Vẽ và màu,Scholastic,"Cartooning gives budding artists an opportunity to expand their skills in creating amusing characters and developing dramatic scenes. This accessible guide breaks down the entire process: drawing figures, both human and animal; capturing specialist areas such as heads, faces, and hands; conveying a range of expressions and distinctive features; and even Thiết kếing appropriate costumes. Put your favorite medium to paper and make a monster, complete with effects; a personality-filled rat; an adorably grumpy bulldog; and a man riding a donkey. Duotone lines highlight each step, and the lessons incorporate various types of drawing materials, including pencil, pen, crayon, paints, and charcoal.",Từ 13 tuổi trở lên
4005,"How to draw portraits, faces and heads",https://lotuscommunity.org.vn/wp-content/uploads/2021/10/How-to-draw-portraits-faces-and-heads.jpg,31-3,022,Mark Bergin,Sách về sở thích,Vẽ và màu,Salariya Book ,"Every person is unique, and in this book you'll find the skills to draw each person's distinctive facial features, like the expression on their face or the years of experience held in their wrinkles. This books also features tips on drawing accessories like spectacles and hats. The How To Draw series takes a highly visual and practical approach to drawing, featuring step-by-step instructions for each art project. Duotone lines highlight each step. Each title includes information on the drawing materials you can use and where to use them most effectively. Pencil, pen, crayon, paints and charcoal and more are all covered in detail. The series covers a comprehensive range of rudimentary techniques - with sections on materials, composition and perspective. The How To Draw series is an excellent way to introduce the concepts of drawing to child and adult alike.",Từ 13 tuổi trở lên
4079,Hunted,https://lotuscommunity.org.vn/wp-content/uploads/2021/10/Hunted.jpg,33-5,018,James Patterson,Sách truyện người lớn,Bí ẩn,BookShots,"In the English countryside, a former Special Forces officer must go undercover in a high stakes game . . . but he might not make it out alive.
Someone is luring men from the streets to play a mysterious, high stakes game in the English countryside. Former Special Forces officer David Shelley will go undercover to shut it down - but this might be a game he can't win.",Từ 13 tuổi trở lên
4080,Hunted,https://lotuscommunity.org.vn/wp-content/uploads/2021/10/Hunted.jpg,34-2,035,James Patterson,Sách truyện người lớn,Bí ẩn,BookShots,"In the English countryside, a former Special Forces officer must go undercover in a high stakes game . . . but he might not make it out alive.
Someone is luring men from the streets to play a mysterious, high stakes game in the English countryside. Former Special Forces officer David Shelley will go undercover to shut it down-but this might be a game he can't win.",Từ 13 tuổi trở lên
4114,I am your pet: rat,https://lotuscommunity.org.vn/wp-content/uploads/2021/10/I-am-your-pet-rat.jpg,29-4R,009,Matthew Rayner,Sách về sở thích,Thú cưng,Gareth Stevens Pub Learning library,"Describes the physical characteristics, behaviors, and diet of rats and tells the best way to cage, feed, and play with them as Thú cưng.",10-12 tuổi
4186,I love Zoella,https://lotuscommunity.org.vn/wp-content/uploads/2021/10/I-love-Zoella.jpg,33-5,057,Kate Hamilton,Sách truyện người lớn,Lãng mạn,Buster,"This book is the ultimate must-have for any true fan. It's packed with all you need to know about the Queen of Vlogging, plus quizzes and puzzles to test your Zoella knowledge, fun fill-in stories to complete, and tips on starting your own vlog. Grab a pen and get ready to enter the world of Zoe Sugg!",Từ 13 tuổi trở lên
4190,I nearly died laughing: the darkly comic world of Tony Husband,https://lotuscommunity.org.vn/wp-content/uploads/2021/10/I-nearly-died-laughing-the-darkly-comic-world-of-Tony-Husband.jpg,28-3,010,Tony Husband,Sách về cách sống,Hài hước,Arcturus Publishing Limited,"Tony Husband is one of the UK's leading cartoonists. In a long career, beginning in 1984, he has created cartoons for many leading publications, including The Spectator, Private Eye, The Times, and Punch. Tony has won more than fifteen major awards, including the prestigious Pont Award. Black Hài hước never goes out of fashion and the truths about human nature revealed by Husband's work never cease to tickle the funny bone, no matter how many times readers leaf through these pages.",Từ 13 tuổi trở lên
4191,I nearly died laughing: the darkly comic world of Tony Husband,https://lotuscommunity.org.vn/wp-content/uploads/2021/10/I-nearly-died-laughing-the-darkly-comic-world-of-Tony-Husband.jpg,28-3,008,Tony Husband,Sách về cách sống,Hài hước,Arcturus Publishing Limited,"Tony Husband is one of the UK's leading cartoonists. In a long career, beginning in 1984, he has created cartoons for many leading publications, including The Spectator, Private Eye, The Times, and Punch. Tony has won more than fifteen major awards, including the prestigious Pont Award. Black Hài hước never goes out of fashion and the truths about human nature revealed by Husband's work never cease to tickle the funny bone, no matter how many times readers leaf through these pages.",Từ 13 tuổi trở lên
4205,I spy fantasy,https://lotuscommunity.org.vn/wp-content/uploads/2021/10/I-spy-fantasy.jpg,30-5R,005,Jean Marzollo,Sách học và hoạt động,Hoạt động (0-6 tuổi),Cartwheel Books,This bestselling book features riddles that send readers searching through 13 photographs that feature fantastical settings!,0-6 tuổi
4344,In the sea there are crocodiles,https://lotuscommunity.org.vn/wp-content/uploads/2021/10/In-the-sea-there-are-crocodiles.jpg,33-3,069,Fabio Geda,Sách truyện người lớn,Truyền cảm hứng,Vintage,"The hope of a better life is stronger than any other feeling. My mother decided it was better to know I was in danger far from her; but on the way to a different future, than to know I was in danger near her; but stuck in the same old fear.
At the age of ten, Enaiatollah Akbari was left alone to fend for himself. This is the heartbreaking, unforgettable story of his journey from Afghanistan to Italy in an attempt to find a safe place to live.",Từ 13 tuổi trở lên
4411,Invisible things,https://lotuscommunity.org.vn/wp-content/uploads/2021/10/Invisible-things.jpg,33-5,016,Jenny Davidson,Sách truyện người lớn,Bí ẩn,HarperTeen,"Sixteen-year-old Sophie knows there is more to the story of her parents' death. And she's on a mission to find the truth. To aid her in solving the decades-old Bí ẩn, Sophie has enlisted her best friend, Mikael, whose friendship has turned into something more. It's soon clear that Sophie's future is very much wrapped up in the details of her family's past, and the key lies with information only one man can provide: her parents' former employer, the elusive billionaire Alfred Nobel.

As the threat of war looms in Europe, dangers to Sophie and her loved ones grow. While her determination to solve the Bí ẩn doesn't waver, forces beyond her control conspire to keep her from her purpose. Then, news of her great-aunt Tabitha's death sets off a chain of events that leaves Sophie questioning everything.

The more Sophie learns, the more she realizes that nothing—and no one—in her life is what it seems. And coming to terms with the dark secrets she uncovers means imagining a truth that she never dreamed possible. Full of gorgeous settings, thrilling Phiêu lưu, and Lãng mạn, invisible things is a novel that dares to ask, what if?",Từ 13 tuổi trở lên
4540,Jack Holborn,https://lotuscommunity.org.vn/wp-content/uploads/2021/10/Jack-Holborn.jpg,33-6,045,Leon Garfield,Sách truyện người lớn,Phiêu lưu,"Oxford University Press
","An action-packed pirate story, with bloodcurdling deaths, terrifying ghosts and Phiêu lưus galore on the high seas. Orphan Jack Holborn stows away on a ship, little guessing the dangers and excitements that lie on his journey ahead. Before long he finds himself caught up in the middle of a Bí ẩn surrounding his long-lost mother, but before he can discover the truth, he has to survive the quest through an eerie African jungle for a famous diamond, worth more than Jack's wildest dreams.",Từ 13 tuổi trở lên
4572,Japanese Design,https://lotuscommunity.org.vn/wp-content/uploads/2021/10/Japanese-design.jpg,31-2,030,Penny Sparke,Sách về sở thích,Thiết kế,Plume,"Discusses and illustrates the application of Japanese thought, aesthetics, and culture to the Thiết kế of modern consumer goods.",Từ 13 tuổi trở lên
4603,Joey Pigza loses control,https://lotuscommunity.org.vn/wp-content/uploads/2021/10/Joey-pigza-loses-control.jpg,34-2,022,Jack Gantos,Sách truyện người lớn,Thực tế,Harper Trophy,"Joey Pigza really wants his six-week visit with his dad to count, to show him he's not as wired as he used to be, to show his dad how much he loves him. But Carter Pigza's not an easy guy to love. He's eager to make it up to Joey for past wrongs and to show him how to be a winner, to take control of his life. With his coaching, Joey's even learned how to pitch a baseball, and he's good at it. The trouble is, Joey's dad thinks taking control means giving up the things that keep Joey safe. And if he wants to please his dad, he's going to have to play by his rules, even when the rules don't make sense",Từ 13 tuổi trở lên
4609,John Carter: the movie novelization,https://lotuscommunity.org.vn/wp-content/uploads/2021/10/John-Carter-the-movie-novelization.jpg,34-3,083,Disney,Sách truyện người lớn,Phiêu lưu,Disney Editions,"This adaptation will not only give readers an amazing novelization of the upcoming John Carter film, but also the original text of A Princess of Mars, by Edgar Rice Burroughs. A Princess of Mars was the first book to feature John Carter, led to an eleven-book series featuring his Phiêu lưus, and was also the basis for the 2012 movie!
The movie John Carter tells the story of a war-weary former military captain during the Civil War, who is inexplicably transported to Mars. He quickly (and reluctantly) becomes embroiled in a conflict of epic proportions amongst the inhabitants of the planet. The adaptation, written by Stuart Moore, wonderfully brings the movie's otherworldly action and Phiêu lưu to the page, while keeping the themes of family, planetary survival, and loyalty at heart.",Từ 13 tuổi trở lên
4629,Julius Caesar,https://lotuscommunity.org.vn/wp-content/uploads/2021/10/Julius-Caesar.jpg,32-2,048,Tony Bradman,Sách truyện người lớn,Thực tế,A & C Black Publishers Ltd,"Tony Bradman creates a thrilling narrative retelling of Shakespeare's tragedy, Julius Caesar.

Marcus Brutus is a close friend of Julius Caesar, emperor of Rome. So how does he find himself involved in a tangled plot for his
assassination? The conspirators and the public become embroiled in the
never-ending political machinations of the great empire, with struggles
for leadership and power. And once the
terrible chain of events has been set in motion, is there any way of stopping them, or any way out?",Từ 13 tuổi trở lên
4663,Just look at me now,https://lotuscommunity.org.vn/wp-content/uploads/2021/10/Just-look-at-me-now.jpg,33-3,001,Nell Dixon,Sách truyện người lớn,Lãng mạn, Little Black Dress,"Tia’s top beauty tip: apply heavy make-up carefully to prevent any cracks from showing…
Life is fabulous for Tia Carpenter. She has it all, money, looks, a great job as the beauty expert at stylish Platinum magazine and, at last, the attention of her unrequited high school love, Josh Banks. But Tia has a secret – back at school she was Barbara Baker, overweight, crooked teeth, frizzy hair and no fashion sense. Cosmetic dentistry, losing seven stones in weight and a complete makeover later, Tia has successfully erased her past life as Big Barb, tub of lard, until the day Juliet Gold, the bane of her teenage existence, arrives to work at the magazine. Juliet always got everything she ever wanted, and now she wants both Tia’s job and Josh. Tia will have to use every makeover trick she’s ever learned to stop Juliet from uncovering her past and stealing her man.",Từ 13 tuổi trở lên
4669,Kaffir boy,https://lotuscommunity.org.vn/wp-content/uploads/2021/10/Kaffir-boy.jpg,33-2,040,Mark Mathabane,Sách truyện người lớn,Truyền cảm hứng,Free Press,"The classic story of life in Apartheid South Africa.
Mark Mathabane was weaned on devastating poverty and schooled in the cruel streets of South Africa's most desperate ghetto, where bloody gang wars and midnight police raids were his rites of passage. Like every other child born in the hopelessness of apartheid, he learned to measure his life in days, not years. Yet Mark Mathabane, armed only with the courage of his family and a hard-won education, raised himself up from the squalor and humiliation to win a scholarship to an American university.

This extraordinary memoir of life under apartheid is a triumph of the human spirit over hatred and unspeakable degradation. For Mark Mathabane did what no physically and psychologically battered ""Kaffir"" from the rat-infested alleys of Alexandra was supposed to do -- he escaped to tell about it.",Từ 13 tuổi trở lên
4743,Kidnap in the Caribbean,https://lotuscommunity.org.vn/wp-content/uploads/2021/10/Kidnap-in-the-Caribbean.jpg,33-3,031,Lauren St John,Sách truyện người lớn,Bí ẩn,Orion Children's Books,"Laura Marlin has no idea that her dream holiday to the Caribbean might cost her and everyone she loves their lives. But almost as soon as they board the luxury cruise ship mysteries begin to pile up and sinister events spiral out of control. When her uncle disappears, Laura, her best friend Tariq, and beloved husky Skye must play a deadly game with their enemies. Thousands of miles from home, face to face with pirates, a volcano and hungry sharks, their best hope of survival is the advice of a fictional detective and the help of disaster-prone Jimmy Gannet!",Từ 13 tuổi trở lên
4784,Kitchen wit,https://lotuscommunity.org.vn/wp-content/uploads/2021/10/Kitchen-wit.jpg,28-3,069,Jane Brook,Sách về cách sống,Hài hước,Summersdale Publishers,"Cooking is like love. It should be entered into with abandon or not at all' Harriet van Horne'I tried boiling pigs' feet once, but I couldn't get the pig to stand still' Groucho MarxCooks, imbibers and gourmands will savour every mouthful of this feast of wit. With a menu that includes chefs, food writers and classic Hài hướcists, you'll be laughing from breakfast to supper and coming back for seconds.",Từ 13 tuổi trở lên
4786,Kitten smitten,https://lotuscommunity.org.vn/wp-content/uploads/2021/10/Kitten-smitten.jpg,34-2,024,Anna Wilson,Sách truyện người lớn,Thực tế,"Macmillan Children's Books
","Bertie Fletcher is back! She's happier than a cat who's got the custard when she gets Jaffa, her very own beautiful marmalade kitten. Even Dad seems to have come to terms with the whole pet-owning thing. But then the horrendously over-perfect Meerley family arrives on the scene and Jaffa is caught in a tug-of-love between them and Bertie. Who will Jaffa decide she wants to live with? May the best family win!

The sequel to kitten kaboodle, this is another funny and heart-warming story about a kitten with lashings of cattitude!",Từ 13 tuổi trở lên
4797,Kitty corner,https://lotuscommunity.org.vn/wp-content/uploads/2021/10/Kitty-corner.jpg,29-4R,019,Ellen Miles,Sách về sở thích,Thú cưng,Scholastic,"From the bestselling author of the puppy place

Mia and Michael Battelli want a pet more than anything. And a cuddly cat or kitten would be perfect for their small brownstone apartment. But their parents aren't sure Mia and Michael are ready for the responsibility.

Then Mia spots a tiny calico foraging for food. Callie doesn't seem to belong to anyone - and she's hurt. Mia can't just leave her to fend for herself! But what if she can't convince her parents to keep the sweet little kitten? Will Callie ever find a home?",10-12 tuổi
4927,Lemony Snicket: shouldn't you be in school?,https://lotuscommunity.org.vn/wp-content/uploads/2021/10/Lemony-Snicket-shouldn_t-you-be-in-school.jpg,33-5,025,Lemony Snicket,Sách truyện người lớn,Phiêu lưu,Little Brown Books for Young Readers,The eagerly anticipated third book in the series All The Wrong Questions. Do you smell smoke? Young apprentice Lemony Snicket is investigating a case of arson but soon finds himself enveloped in the ever-increasing Bí ẩn that haunts the town of Stain’d-by-the-Sea.Who is setting the fires? What secrets are hidden in the Department of Education? Why are so many schoolchildren in danger? Is it all the work of the notorious villain Hangfire? How could you even ask that? What kind of education have you had?Maybe you should be in school.,Từ 13 tuổi trở lên
4929,Leo Da Vinci versus the ice cream domination league,https://lotuscommunity.org.vn/wp-content/uploads/2021/10/Leo-Da-Vinci-versus-the-ice-cream-domination-league.jpg,33-5,013,Michael Pryor,Sách truyện người lớn,Phiêu lưu,Random House Australia,"From the author of the Laws of Magic series comes a new series for boys that reimagines the famous inventor and artist Leonardo da Vinci as a 10-year-old boy living in our century

And what would that Leo do? Of course, he’d use his genius for good by starting a Fixit company to save the world from evildoers like Wild Wilbur and the Ice-cream Domination League, along with his sidekicks (a robot and a talking pig) and with the help of a girl from school who insists on tagging along whether Leonardo likes it or not. This is lots of fun, with plenty of out-there superhero and supervillain craziness, combined with the normal stuff of family, friends, and homework.",Từ 13 tuổi trở lên
4935,Leonardo da Vinci,https://lotuscommunity.org.vn/wp-content/uploads/2021/10/Leonardo-da-Vinci.jpg,32-1,060,Mary Pope Osborne,Sách truyện người lớn,Thực tế,Random House Children's Books,"The number 1 bestselling chapter book series of all time celebrates 25 years with new covers and a new, easy-to-use numbering system! Getting the facts behind the fiction has never looked better. Track the facts with Jack and Annie!!

When Jack and Annie got back from their Phiêu lưu in Magic Tree House Merlin Mission #10: Monday with a Mad Genius, they had lots of questions. Why was Leonardo da Vinci interested in flight? What are some of his most famous painting? Did he really keep noteboooks just like Jack? What do scientists today think of his ideas? Find out the answers to these questions and more as Jack and Annie track the facts.

Filled with up-to-date information, photos, illustrations, and fun tidbits from Jack and Annie, the Magic Tree House Fact Trackers are the perfect way for kids to find out more about the topics they discovered in their favorite Magic Tree House Phiêu lưus. And teachers can use Fact Trackers alongside their Magic Tree House fiction companions to meet common core text pairing needs.

Did you know that there’s a Magic Tree House book for every kid?

Magic Tree House: Phiêu lưus with Jack and Annie, perfect for readers who are just beginning chapter books
Merlin Missions: More challenging Phiêu lưus for the experienced reader
Super Edition: A longer and more dangerous Phiêu lưu
Fact Trackers: Nonfiction companions to your favorite Magic Tree House Phiêu lưus

Have more fun with Jack and Annie at MagicTreeHouse.com!",Từ 13 tuổi trở lên
