S/N,Title,Images,Shelflist,Position,Author,Category,SubCategory,Publisher,Description,Tags
2234,Dog tags: prisoners of war,https://lotuscommunity.org.vn/wp-content/uploads/2021/10/Dog-tags-prisoners-of-war.jpg,34-6,079,Alexander London,Sách truyện người lớn,Thực tế,Scholastic,"Man's best friend goes to war.
Two enemy soldiers. One uneasy alliance.
Miguel is a medic in the US Army. Stationed in a remote Belgian forest during World War II, he's expecting a quiet tour of duty. But the Nazis have other ideas. They launch a surprise attack . . . one that separates Miguel from his entire division.
Alone and lost in enemy territory, Miguel discovers an abandoned dog, left behind by German forces. The dog could be just the ally Miguel needs to get out of the forest alive. There's a catch, though. The dog has been trained by the Nazis to see Miguel as the enemy. Can a young soldier teach an old dog new tricks?",Từ 13 tuổi trở lên
2243,Dogs: a portrait in pictures and words,https://lotuscommunity.org.vn/wp-content/uploads/2021/10/Dogs-a-portrait-in-pictures-and-words.jpg,29-4R,020,Charlotte Fraser,Sách về sở thích,Thú cưng,Summersdale,"A dog is a creature of love. Their never-ending loyalty and boundless enthusiasm is the light in any dog lover’s life.
This handsome photographic collection of the most eye-catching and enchanting dogs, packed with witty quotes and heart-warming poems, is guaranteed to captivate and charm anybody who has ever known the companionship of a dog.",10-12 tuổi
2292,Double or die: a James Bond Adventure,https://lotuscommunity.org.vn/wp-content/uploads/2021/10/Double-or-die-a-James-Bond-adventure.jpg,34-4,010,Charlie Higson,Sách truyện người lớn,Bí ẩn,Hyperion Press,"Kidnapping. Explosions. Murder. This is no ordinary weekend. But then, James Bond is no ordinary boy... In a north London cemetery, a professor is kidnapped at gunpoint. Then, a suspicious letter crammed with cryptic clues arrives at Eton. To decipher the deadly Bí ẩn, James Bond must take a series of dangerous gambles. Once the code is cracked, he has just forty-eight hours to save the professor from the dark forces that threaten to destroy them both. And if they can't escape, it's not only their future under threat. It's the rest of the world's...",Từ 13 tuổi trở lên
2377,Dublin people: short stories ,https://lotuscommunity.org.vn/wp-content/uploads/2021/10/Dublin-people-short-stories.jpg,33-1,038,Maeve Binchy,Sách truyện người lớn,Thực tế,Oxford,"A young country girl comes to live and work in Dublin. Jo is determined to be modern and independent, and to have a wonderful time. But life in a big city is full of strange surprises for a shy country girl . . . Gerry Moore is a man with a problem - alcohol. He knows he must give it up, and his family and friends watch nervously as he battles against it. But drink is a hard enemy to fight . . . These stories by the Irish writer Maeve Binchy are full of affectionate humour and wit, and sometimes a little sadness.",Từ 13 tuổi trở lên
2394,Earth girl,https://lotuscommunity.org.vn/wp-content/uploads/2021/10/Earth-girl.jpg,33-5,029,Janet Edwards,Sách truyện người lớn,Khoa học,Pyr,"A sensational YA Khoa học debut from an exciting new British author! Just because she's confined to the planet, doesn't mean she can't reach for the stars. 2788. Only the handicapped live on Earth. Eighteen-year-old Jarra is among the one in a thousand people born with an immune system that cannot survive on other planets. Sent to Earth at birth to save her life, she has been abandoned by her parents. She can't travel to other worlds, but she can watch their vids, and she knows all the jokes they make. She's an ""ape,"" a ""throwback,"" but this is one ape girl who won't give in. Jarra makes up a fake military background for herself and joins a class of norms who are on Earth for a year of practical history studies excavating the dangerous ruins of the old cities. She wants to see their faces when they find out they've been fooled into thinking an ape girl was a norm. She isn't expecting to make friends with the enemy, to risk her life to save norms, or to fall in love.",Từ 13 tuổi trở lên
2457,Eight jewels of the phoenix,https://lotuscommunity.org.vn/wp-content/uploads/2021/10/Eight-jewels-of-the-phoenix.jpg,33-2,028,Tutu Dutta-Yean,Sách truyện người lớn,Tưởng tượng,MPH Books,"This volume brings together eight folktales and legends from countries around the Asia-Pacific Rim. The tales have been retold and reinterpreted in many forms through the ages. Like the phoenix, they are fierce and full of colour, magic and Phiêu lưu. The places brought to life in this collection include China, India, Japan, Malaysia, the Philippines, North America and Thailand.",Từ 13 tuổi trở lên
2458,Eight jewels of the phoenix,https://lotuscommunity.org.vn/wp-content/uploads/2021/10/Eight-jewels-of-the-phoenix.jpg,33-2,042,Tutu Dutta-Yean,Sách truyện người lớn,Tưởng tượng,MPH Books,"This volume brings together eight folktales and legends from countries around the Asia-Pacific Rim. The tales have been retold and reinterpreted in many forms through the ages. Like the phoenix, they are fierce and full of colour, magic and Phiêu lưu. The places brought to life in this collection include China, India, Japan, Malaysia, the Philippines, North America and Thailand.",Từ 13 tuổi trở lên
2464,Electrotaur and Slashermite,https://lotuscommunity.org.vn/wp-content/uploads/2021/10/Electrotaur-and-Slashermite.jpg,34-3,018,Ali Sparkes,Sách truyện người lớn,Tưởng tượng,Scholastic,"Jack and Lewis never dreamed their monster drawings would come to life, but the boys wake up to find their latest creations, Electrotaur and Slashermite, are in their bedroom. From that point on, Jack and Lewis' lives are turned upside down.",Từ 13 tuổi trở lên
2492,Elliot and the goblin war,https://lotuscommunity.org.vn/wp-content/uploads/2021/10/Elliot-and-the-goblin-war.jpg,33-5,005,Jennifer Nielsen,Sách truyện người lớn,Tưởng tượng,Sourcebooks Young Readers ,"As of today, there are only 7 children who have ever read this book and lived to tell about it. 95 children successfully read the first chapter, but upon beginning chapter 2, they started blabbering in some language known only as ""flibberish."" 38 children made it halfway through this wretched book before they began sucking their thumbs through their noses.

If you're very brave, perhaps you are willing to take your chances. Be sure that you have told your family who gets your favorite toys if you do not survive this book. Read it now, if you dare. But don't say you haven't been warned, for this is the story that unfolds the mysteries of the underworld.",Từ 13 tuổi trở lên
2533,End zone,https://lotuscommunity.org.vn/wp-content/uploads/2021/10/End-zone.jpg,33-3,055,Tiki Barber,Sách truyện người lớn,Thực tế,Simon Schuster,"The Hidden Valley Eagles have high hopes for the football championship in this middle grade novel from NFL superstars and bestselling authors Tiki and Ronde Barber.

Tiki and Ronde are ready to end junior high with a win—a big win! Their dream is to see their team in the championship, and with the Hidden Valley Eagles’ undefeated season, their chances are strong.

But when Manny, the star quarterback, starts having headaches, the doctor says he has a minor concussion, and he is out for two weeks. The whole school is counting on the team, but with pressure building, Tiki and Ronde are starting to lose their confidence. More than that, they think their good luck is going to run out. Will the team let an injury keep them from the championship? Or can they learn to work together to bring home a win?

From real-life NFL superstar brothers Tiki and Ronde Barber, this is an inspiring story of teamwork and triumph.",Từ 13 tuổi trở lên
2586,Essex Girls,https://lotuscommunity.org.vn/wp-content/uploads/2021/10/Essex-Girls.jpg,34-2,063,Laura Ziepe,Sách truyện người lớn,Lãng mạn,Avon,"You can take the girl out of Essex …
You’ll be well jel over the Phiêu lưus of three good-hearted, strong-willed, fake-baked Essex Girls. Fun, fresh and always ream, this novel Perfect for fans of TOWIE and the novels of Katie Price.
Jade did everything she could to fit in at university – toned down her tan, gave up on her favourite fake lashes, swapped Thiết kếer dresses for jeans. And it seemed to make her boyfriend Tom happy. But obviously not quite happy enough.
When. Jade finds Tom’s been cheating she heads home: to Essex. Reunited with her best mates Kelly and Lisa, even a night out at The Sugar Hut isn’t enough to put a smile back on her face. So they hatch a plan to get away from it all, to a place so ream it’s unreal – Marbella. Sun, sea, men, vajazzles: what could possibly go wrong?

A fun, fresh and always polished novel for the Essex Girl in all of us",Từ 13 tuổi trở lên
2701,Fairyland magic,https://lotuscommunity.org.vn/wp-content/uploads/2021/10/Fairyland-magic.jpg,30-5R,002,Patricia Moffett,Sách học và hoạt động,Hoạt động (0-6 tuổi),Carlton Books,"It's fairyland magic - with a little help from modern-day technology! Open this book, hold it up your computer's webcam, touch a key, and watch a pretty fairy come to life. From out of the pages will fly the fairy queen; a woodland fairy, flapping its wings and playing a flute; a gentle flower fairy, and another who will land on your hand.
Each spread contains three animations that will take children into a new dimension, while the fascinating text reveals secret details of the fairy realm. All that's needed is a computer and webcam; the book includes a CD-Rom to install the software. No Internet required!",0-6 tuổi
2702,Fairyland magic,https://lotuscommunity.org.vn/wp-content/uploads/2021/10/Fairyland-magic.jpg,30-5R,003,Patricia Moffett,Sách học và hoạt động,Hoạt động (0-6 tuổi),Carlton Books,"It's fairyland magic - with a little help from modern-day technology! Open this book, hold it up your computer's webcam, touch a key, and watch a pretty fairy come to life. From out of the pages will fly the fairy queen; a woodland fairy, flapping its wings and playing a flute; a gentle flower fairy, and another who will land on your hand.
Each spread contains three animations that will take children into a new dimension, while the fascinating text reveals secret details of the fairy realm. All that's needed is a computer and webcam; the book includes a CD-Rom to install the software. No Internet required!",0-6 tuổi
2703,Fairyland magic,https://lotuscommunity.org.vn/wp-content/uploads/2021/10/Fairyland-magic.jpg,30-5R,004,Patricia Moffett,Sách học và hoạt động,Hoạt động (0-6 tuổi),Carlton Books,"It's fairyland magic - with a little help from modern-day technology! Open this book, hold it up your computer's webcam, touch a key, and watch a pretty fairy come to life. From out of the pages will fly the fairy queen; a woodland fairy, flapping its wings and playing a flute; a gentle flower fairy, and another who will land on your hand.
Each spread contains three animations that will take children into a new dimension, while the fascinating text reveals secret details of the fairy realm. All that's needed is a computer and webcam; the book includes a CD-Rom to install the software. No Internet required!",0-6 tuổi
2777,Feathered serpent,https://lotuscommunity.org.vn/wp-content/uploads/2021/10/Feathered-serpent.jpg,33-5,034,Xu Xiaobin,Sách truyện người lớn,Phiêu lưu,Atria,"This beautifully portrayed epic family history spans one hundred years, from the 1890s during the later stages of the Qing Dynasty to the 1990s, traversing the experiences of five generations of women. Yu is the central character, whose life story is woven through the lives of her grandmother, mother, sisters, and niece. She loves her parents but at a tender age realizes they do not love her. After committing two unforgivable sins, she is sent away to live in the city but is soon abandoned. Yu's life becomes a quest for love; she is fragile but resilient, lonely but determined. Now, in the 1980s, Yu becomes caught up in the political storm and comes close to love but falls short. Her last chance at getting what she desires will ultimately come at a tragic cost.

A political satirist in the guise of a mystical writer, Xu Xiaobin masterfully creates an atmosphere where distinctions are blurred; memories of the past and present are intertwined; realities and illusions are fused without a clear trace; and events occur in unspecified places but tinted with fairylike imaginations.",Từ 13 tuổi trở lên
2790,Felix Frost: time detective,https://lotuscommunity.org.vn/wp-content/uploads/2021/10/Felix-Frost-time-detective.jpg,33-5,062,Eleanor Hawken,Sách truyện người lớn,Tưởng tượng,"Quercus Children's Books
","How to build an accidental time machine:
1. Activate your homemade particle accelerator
2. Fail to supervise your pet chameleon
3. Watch in horror as he kicks a quartz rock in front of the particle ray
... and BAM! Let the Phiêu lưus begin!
Join Felix Frost, secret boy genius, his chameleon Einstein and his classmate Missy as they travel back in time to Ancient Rome, where terrifying danger and embarrassing togas await.
But can they solve the riddle of a mysterious gladiator skeleton without getting themselves skewered in the gladiator arena?
Funny, fast-paced and full of you-won't-believe-it facts, Felix Frost: Time Detective will have readers hooked on history and sold on science!",Từ 13 tuổi trở lên
2800,Fetching,https://lotuscommunity.org.vn/wp-content/uploads/2021/10/Fetching.jpg,33-3,075,Kiera Stewart,Sách truyện người lớn,Thực tế,Little Brown Books for Young Readers,"Olivia has just about had it with the popular kids at school. She and her friends have done nothing to deserve evil pranks and awful name-calling, but that doesn't stop queen bee Brynne from humiliating them on a daily basis. If only Olivia's classmates were more like the adorable dogs she helps her grandmother train-poorly behaved, but improvable. Wait... what if her tormentors' behavior actually could be modified using the same type of training that works on dogs? Olivia and her friends are desperate enough to give it a try. But is it really possible that the underdogs of Hubert C. Frost Middle School could make it to head of the pack?",Từ 13 tuổi trở lên
2801,Fever,https://lotuscommunity.org.vn/wp-content/uploads/2021/10/Fever.jpg,33-2,036,Dee Shulman,Sách truyện người lớn,Lãng mạn,Penguin,"Fever is first book in the gripping Parallon Trilogy by award-winning author and illustrator Dee Shulman. Two worlds. Two millennia. One love... A fearless Roman gladiator. A reckless 21st-century girl. A mysterious virus unites them...152 AD. Sethos Leontis, a skilled and mesmerizing fighter, is unexpectedly wounded and lies dangerously close to death. 2012 AD. Eva is brilliant - but troubled. Starting her new life at a school for the gifted, a single moment in the lab has terrifying results. An extraordinary link brings Sethos and Eva together, but it could force them apart - because the fever that grips them cannot be cured and falling in love could be lethal... Can love survive when worlds collide and threaten time itself? ",Từ 13 tuổi trở lên
2962,Forever and ever and Evie,https://lotuscommunity.org.vn/wp-content/uploads/2021/10/Forever-and-ever-and-Evie.jpg,33-2,070,Karen McCombie,Sách truyện người lớn,Thực tế,Scholastic,"Stella’s back in London to see her old mates – yay! – and do a sneaky bit of detective work. But with a family Bí ẩn to solve, and Portbay weirdness following her every move, her big reunion isn’t exactly as planned.
Will Stella find what’s she’s looking for?",Từ 13 tuổi trở lên
2998,Frankenweenie,https://lotuscommunity.org.vn/wp-content/uploads/2021/10/Frankenweenie.jpg,32-5,088,Elizabeth Rudnick,Sách truyện người lớn,Tưởng tượng,Disney Press,"Frankenweenie is about a clever, quiet, scientifically minded boy named Victor, who lives in the Burbank-esque town of New Holland. Victor’s only friend is his dog, Sparky, who dies when he is hit by a car, but is reanimated by Victor. This clever and fresh take on the Frankenstein tale will delight readers of all ages.",Từ 13 tuổi trở lên
3107,Garfield and co: Mother Garfield,https://lotuscommunity.org.vn/wp-content/uploads/2021/10/Garfield-and-co-Mother-Garfield.jpg,34-1,044,Jim Davis,Sách truyện người lớn,Phiêu lưu,Papercutz,"Hunting birds is something Garfield's never had any interest in. But when he finds a nest full of abandoned eggs, Garfield puts his feline pride aside and decides to help them hatch. Harry, the stray cat from down the block, would love to put the newborn birds right on his dinner menu. As soon as they hatch, the birds assume Garfield is their mother and start following him around everywhere! Garfield can't take naps any more, and his water bowl has been turned into a bird bath. Is Garfield stuck being the birds' mom forever? Also featuring the stories ""Curse of the Were-dog"" and ""Little Yellow Riding Hood.""",Từ 13 tuổi trở lên
3261,Goddess Girls: Hestia the invisible,https://lotuscommunity.org.vn/wp-content/uploads/2021/10/Goddess-Girls-Hestia-the-invisible.jpg,33-4,082,Joan Holub,Sách truyện người lớn,Tưởng tượng,Aladdin,"Hestia feels unseen at Mount Olympus Academy in this eighteenth Goddess Girls Phiêu lưu.
Hestia, the sweet goddess of the hearth, loves to cook, but is too shy to share her passion with other students. Her famous yambrosia salad is a MOA favorite-but no one has any idea that it was her recipe!

When she has to pick a symbol that represents her highest self for a Service to Humankind contest, her classmates laugh at her first choice of an ordinary cooking pot. After initial embarrassment, Hestia becomes determined to break out of her shell and stop feeling so invisible around everyone at MOA.

With the help of Pheme and a lizard-tail boy named Asca, she begins to see that she has much to offer to others. But will her quest not show her best self after all?",Từ 13 tuổi trở lên
3262,Goddess Girls: Medusa the rich,https://lotuscommunity.org.vn/wp-content/uploads/2021/10/Goddess-GirlsMedusa-the-rich.jpg,32-1,075,Joan Holub,Sách truyện người lớn,Tưởng tượng,Aladdin,"Medusa discovers that having the golden “King Midas” touch has its ups and downs in the sixteenth Goddess Girls Phiêu lưu.

When Medusa suddenly becomes able to turn objects into gold just by touching them, she is thrilled. Gold, gold, everywhere! But it’s not just objects that become golden—it’s also food, and, even people! Her new ability turns out to be more dangerous than delightful, but can she do anything to reverse it?",Từ 13 tuổi trở lên
3392,Grasshopper jungle,https://lotuscommunity.org.vn/wp-content/uploads/2021/10/Grasshopper-jungle.jpg,33-4,064,Andrew Smith,Sách truyện người lớn,Tưởng tượng,Dutton Books for Young Readers,"In the small town of Ealing, Iowa, Austin and his best friend, Robby, have accidentally unleashed an unstoppable army. An army of horny, hungry, six-foot-tall praying mantises that only want to do two things.

This is the truth. This is history.
It’s the end of the world. And nobody knows anything about it.
You know what I mean.
Funny, intense, complex, and brave, Grasshopper Jungle brilliantly weaves together everything from testicle-dissolving genetically modified corn to the struggles of recession-era, small-town America in this groundbreaking coming-of-age stunner.",Từ 13 tuổi trở lên
3415,Green heart,https://lotuscommunity.org.vn/wp-content/uploads/2021/10/Green-heart.jpg,33-5,035,Alice Hoffman,Sách truyện người lớn,Tưởng tượng,Scholastic,"A two-fold tale of grief and hope, loss and love, told as only Alice Hoffman can.
When her family is lost in a terrible disaster, 15-year-old Green is haunted by loss and the past. Struggling to survive in a place where nothing seems to grow and ashes are everywhere, Green retreats into the ruined realm of her garden. But in destroying her feelings, she also begins to destroy herself. It is only through a series of mysterious encounters that Green relearns the lessons of love and begins to heal as she tells her own story.As she heals, Green lives every day with feelings of loss. Her family is gone, the boy she loves is missing, and the world she once knew has been transformed by tragedy. In order to rediscover the truth about love, hope, and magic, she must venture away from her home, collecting the stories of a group of women who have been branded witches for their mysterious powers. Only through their stories will Green find her own heart's desire.",Từ 13 tuổi trở lên
3460,Gulliver's travels,https://lotuscommunity.org.vn/wp-content/uploads/2021/10/Gulliver_s-travels.jpg,34-3,024,John Malam,Sách truyện người lớn,Tưởng tượng,B.E.S. Publishing,"In this Graphic Classics version of a major eighteenth-century satiric novel, shipwrecked voyager Gulliver is cast ashore among the tiny Lilliputians, where he seems to be a giant, then among the giant Brobdingnags, where he seems as small as a mouse. His later visits to other kingdoms include the Country of the HouyhnhmsÂ - talking horses who demonstrate to Gulliver that humans, whom they call Yahoos, are disgraceful animals. Graphic Classics are graphic novel versions of immortal novels and plays, presented in a way to help make great literary works accessible to students, and encourage boys and girls to discover the joy of reading the masterworks in their original form. Titles in this series tell absorbing, fast-paced stories dramatized with high-quality color illustrations. Each Graphic Classics title includes a thumbnail biography of the author, a list of his or her important works, a timeline of historic events that helped inspire the story, general notes, and an index. Graphic Classics titles are available in both paperback and hardcover editions.",Từ 13 tuổi trở lên
3562,Hartslove,https://lotuscommunity.org.vn/wp-content/uploads/2021/10/Hartslove.jpg,33-3,026,K. M. Grant,Sách truyện người lớn,Thực tế,Quercus Publishing Plc,"Young Daisy and her six brothers and sisters love Hartslove, the crumbling castle that has been in their family for hundreds of years. But their kind but feckless father, scarred by his experiences in the Crimean War, and by his wife's desertion, is drinking the family money away. Then he puts Hartslove up for sale: he has spent his remaining money on a young, wild, horse. Daisy, passionate about her home and her family, is determined that the horse is the One; that he will win the Derby and save them all.

But not everyone at Hartslove is on Daisy's side, and rich people are descending on the castle every day with an eye on snapping it up for themselves. With only months to go before the Derby, can Daisy and her wild brother Garth overcome the odds and lead The One to glory?",Từ 13 tuổi trở lên
3607,Heartside Bay: winter wonderland,https://lotuscommunity.org.vn/wp-content/uploads/2021/10/Heartside-Bay-winter-wonderland.jpg,32-5,067,Cathy Cole,Sách truyện người lớn,Lãng mạn,Scholastic,"Life, love and everything in between. Heartside Bay has been transformed into a Winter Wonderland for a magazine feature. Eve is in her element arranging the glamorous decorations. But her girlfriend Becca can't stand it. Eve must decide if she can love someone who doesn't understand the things she loves.",Từ 13 tuổi trở lên
3611,Hector and the search for happiness,https://lotuscommunity.org.vn/wp-content/uploads/2021/10/Hector-and-the-search-for-happiness.jpg,33-5,072,Francois Lelord,Sách truyện người lớn,Truyền cảm hứng,Penguin Books,"Once upon a time there was a young psychiatrist called Hector who was not very satisfied with himself...
Hector is very good at treating patients in need of his help. But he can't do much for those who are simply dissatisfied with life, and that is beginning to depress him. When a patient tells him he looks in need of a vacation, Hector takes a trip around the world to learn what makes people happy - and sad. As he travels from Paris to China to Africa to the United States, he lists his observations about the people he meets. Is there a secret to happiness, and will Hector find it?
Combining the winsome appeal of The Little Prince with the inspiring philosophy of The Alchemist, Hector's journey ventures around the globe and into the human soul. Lelord's writing inspires us to consider life's great questions. Uplifting, empowering, and optimistic, this is a fable for our times and all time.",Từ 13 tuổi trở lên
3776,Home team,https://lotuscommunity.org.vn/wp-content/uploads/2021/10/Home-team.jpg,34-4,034,Eric Walters,Sách truyện người lớn,Thực tế,Orca Book Publishers,"In the tenth installment of the best-selling Eric Walters basketball series, Nick, Kia and their teammates embark on a letter writing campaign to persuade the Toronto Raptors community relations department to send one or more of the players to visit Clark Boulevard Elementary School. Unfortunately they are too late in applying and the team's school program has already been set for the year. But Nick and Kia do not give up easily, and their efforts become increasingly dramatic until Nick finally comes up with an idea that the team will be unable to ignore.",Từ 13 tuổi trở lên
