S/N,Title,Images,Shelflist,Position,Author,Category,SubCategory,Publisher,Description,Tags
232,A monster calls,https://lotuscommunity.org.vn/wp-content/uploads/2021/10/A-monster-calls.jpg,34-2,013,Patrick Ness,Sách truyện người lớn,Bí ẩn,Candlewick,"The monster in Conor’s backyard is not the one he’s been expecting - the one from the nightmare he’s had every night since his mother started her treatments. This monster is ancient. And wild. And it wants something from Conor. Something terrible and dangerous. It wants the truth. From the final idea of award-winning author Siobhan Dowd - whose premature death from cancer prevented her from writing it herself - Patrick Ness has spun a haunting and darkly funny novel of mischief, loss, and monsters both real and imagined.",Từ 13 tuổi trở lên
276,A really awesome mess,https://lotuscommunity.org.vn/wp-content/uploads/2021/10/A-really-awesome-mess.jpg,33-4,072,Trish Cook,Sách truyện người lớn,Thực tế,Carolrhoda Lab,"Two teenagers. Two very bumpy roads taken that lead to Heartland Academy. After his parents' divorce, Justin is on rocky mental ground. But when a handful of Tylenol lands him in the hospital, he has really hit rock bottom. A scandalous photo of Emmy leads to vicious rumors around school, but things get worse when she threatens the boy who started it all on Facebook. Justin and Emmy arrive at Heartland Academy, a reform school that will force them to deal with their issues. Along the way they will find a ragtag group of teens who are just as broken, stubborn, and full of sarcasm as themselves. A funny, sad, and remarkable story, A Really Awesome Mess is a journey of friendship and self-discovery.",Từ 13 tuổi trở lên
279,A selection of nonsense verse,https://lotuscommunity.org.vn/wp-content/uploads/2021/10/A-selection-of-nonsense-verse.jpg,34-2,078,Edward Lear,Sách truyện người lớn,Thực tế,Egmont Books,"Discover the world of Edward Lear, where everything is out of the ordinary.",Từ 13 tuổi trở lên
378,After earth,https://lotuscommunity.org.vn/wp-content/uploads/2021/10/After-earth.jpg,32-5,066,Peter David,Sách truyện người lớn,Khoa học,Del Rey,"Experience the vast tapestry of After Earth in a novelization unlike any other: a thousand-year saga featuring original content from the mind of Peter David, the veteran sci-fi author who helped develop the richly imagined universe. This is the complete, never-before-seen chronicle of the extraordinary family that’s been across the universe and back - from humanity’s last days on Earth through the events of the epic film!",Từ 13 tuổi trở lên
411,Alchemy and Meggy Swann,https://lotuscommunity.org.vn/wp-content/uploads/2021/10/Alchemy-and-Meggy-Swann.jpg,33-6,043,Karen Cushman,Sách truyện người lớn,Khoa học,Clarion Books,"Fans of Karen Cushman's witty novels will welcome Meggy Swann, newly come to London with her only friend, a goose named Louise. Meggy's mother was glad to be rid of her; her father, who sent for her, doesn't want her after all. Meggy is appalled by London, dirty and noisy, full of rogues and thieves, and difficult to get around in - not that getting around is ever easy for someone who walks with the help of two sticks. Just as her alchemist father pursues his great work of transforming base metal into gold, Meggy finds herself pursuing her own transformation. Elizabethan London has its dark side, but it also has gifts in store for Meggy Swann.",Từ 13 tuổi trở lên
485,All I need,https://lotuscommunity.org.vn/wp-content/uploads/2021/10/All-I-need.jpg,32-2,026,Susane Colasanti,Sách truyện người lớn,Lãng mạn,Speak,"The last night of summer is only the beginning...
Skye wants to meet the boy who will change her life forever. Seth feels their instant connection the second he sees her. When Seth starts talking to Skye at the last beach party of the summer, it's obvious to both of them that this is something real.
But when Seth leaves for college before they exchange contact info, Skye wonders if he felt the same way she did - and if she will ever see him again. Even if they find their way back to each other, can they make a long-distance relationship work despite trust issues, ex drama, and some serious background differences?",Từ 13 tuổi trở lên
499,All woman and springtime,https://lotuscommunity.org.vn/wp-content/uploads/2021/10/All-woman-and-springtime.jpg,33-3,016,B.W. Jones,Sách truyện người lớn,Truyền cảm hứng,Algonquin Books,"Before she met Il-sun in an orphanage, Gi was a hollow husk of a girl, broken from growing up in one of North Korea’s forced-labor camps. A mathematical genius, she learned to cope with pain by retreating into a realm of numbers and calculations, an escape from both the past and the present. Gi becomes enamored of the brash and radiant Il-sun, a friend she describes as “all woman and springtime.” But Il-sun’s pursuit of a better life imperils both girls when her suitor spirits them across the Demilitarized Zone and sells them as sex workers, first in South Korea and then in the United States.
All Woman and Springtime takes us behind the iron curtain of the most mysterious country on earth as it weaves a heartbreaking, breath-taking story.",Từ 13 tuổi trở lên
777,Asterix and the secret weapon,https://lotuscommunity.org.vn/wp-content/uploads/2021/10/Asterix-and-the-secret-weapon.jpg,34-1,031,Albert Uderzo,Sách truyện người lớn,Phiêu lưu,Orion,"A woman bard? That’s unheard of in Ancient Gaul. So, when the mothers in Asterix’s town want to replace Cacofonix with Bravura, the men are horrified. But, Bravura hits the right notes musically, and she proves very valuable when Julius Caesar sends in his secret weapon: a group of female legionnaries. Caesar thinks the Gauls will be too noble to fight the women... but Bravura has no such scruples! And, even Cacofonix succeeds in coming into his own.",Từ 13 tuổi trở lên
782,Astra,https://lotuscommunity.org.vn/wp-content/uploads/2021/10/Astra.jpg,33-3,041,Chris Platt,Sách truyện người lớn,Thực tế,Peachtree Publishing Company,"Horses are Lily’s life, just like they’d been her mother’s. But will her overprotective father stop her from fulfilling her - and her mother’s - dreams?
Thirteen-year-old Lily O’Neil’s passion is Arabian horses. Someday she wants to be a great endurance rider like her mother. But after a freak riding accident took her mother’s life a year earlier, Lily’s father forbade her to ride ever again.
When Lily’s grandmother comes to live with them, however, she convinces Mr. O’Neil to let Lily clean stalls on the neighboring Arabian ranch, a place her mother had worked - and loved. Lily is ecstatic, especially since she’ll be near her mother’s favorite horse, Astra. But when Astra falls ill because of the negligence of her new rider, Lily must fight to save the life of her mother’s beloved mare. Will Astra ever race again?",Từ 13 tuổi trở lên
999,Beastly tales,https://lotuscommunity.org.vn/wp-content/uploads/2021/10/Beastly-tales.jpg,33-4,071,Vikram Seth,Sách truyện người lớn,Tưởng tượng,Phoenix,"Ten witty and enchanting animal fables in verse which, like a modern Aesop's Fables, can be enjoyed by young and old alike",Từ 13 tuổi trở lên
1000,Beastologist: the basilisk's lair,https://lotuscommunity.org.vn/wp-content/uploads/2021/10/Beastologist-the-basilisk_s-lair.jpg,33-3,063,R. L. LaFevers,Sách truyện người lớn,Tưởng tượng,Clarion Books,"Nate Fludd is back in the camel saddle in pursuit of a missing, deadly basilisk - the mythical King of Serpents. As if saving a Dhughani village from the beast isn’t hard enough, Nate and Aunt Phil must begin to solve the Bí ẩn of his parents’ disappearance and protect The Fludd Book of Beasts from a sinister man who always seems to be one step ahead of them.
With more lively illustrations by Kelly Murphy, The Basilisk’s Lair picks up immediately where the first book in the series, Flight of the Phoenix, left off. This historical Tưởng tượng chapter book series is perfect for intermediate readers.",Từ 13 tuổi trở lên
1181,Bitterblue,https://lotuscommunity.org.vn/wp-content/uploads/2021/10/Bitterblue.jpg,34-2,069,Kristin Cashore,Sách truyện người lớn,Tưởng tượng,"Penguin Books
","When Queen Bitterblue took the throne of Monsea, she was a child, and her advisers ran the kingdom for her. Now she is beginning to question their decisions, especially how they handle the legacy of her father Leck, who who ruled through his Grace - a special talent for mind-altering - and his taste for darkness and violence. Bitterblue needs to know Monsea’s past to lead it into the future, so she begins exploring the city sreets at night, disguised and alone. As she does, she meets two thieves, who hold a key to the truth of Leck's reign. And one of them, with a Grace that he hasn't yet identified, holds a key to her heart.",Từ 13 tuổi trở lên
1183,Black and blue,https://lotuscommunity.org.vn/wp-content/uploads/2021/10/Black-and-blue.jpg,33-2,001,James Patterson,Sách truyện người lớn,Tưởng tượng,BookShots,"A beautiful young woman is found murdered on a river bank, and Detective Harriet Blue is convinced she's the next victim of the worst serial killer Sydney has seen in decades.
But the more Harriet learns, the more she realises this murder is not what she first thought. And her own life might be tangled up in the case.",Từ 13 tuổi trở lên
1206,Blizzard of the blue moon,https://lotuscommunity.org.vn/wp-content/uploads/2021/10/Blizzard-of-the-blue-moon.jpg,34-4,083,Mary Pope Osborne,Sách truyện người lớn,Tưởng tượng,Random House Books for Young Readers,"Jack and Annie must rescue a beautiful magical creature - the unicorn. But when they land in New York City during the Depression of the 1930s, Jack and Annie are confused. Where will they find a unicorn in a big city?",Từ 13 tuổi trở lên
1215,Blubber,https://lotuscommunity.org.vn/wp-content/uploads/2021/10/Blubber.jpg,34-2,023,Judy Blume,Sách truyện người lớn,Tưởng tượng,Yearling,"Blubber is a good name for her, the note from Wendy says about Linda. Jill crumples it up and leaves it on the corner of her desk. She doesn't want to think about Linda or her dumb report on the whale just now. Jill wants to think about Halloween.
But Robby grabs the note, and before Linda stops talking it has gone halfway around the room.
That's where it all starts. There's something about Linda that makes a lot of kids in her fifth-grade class want to see how far they can go -- but nobody, least of all Jill, expects the fun to end where it does.",Từ 13 tuổi trở lên
1264,Bookmark days,https://lotuscommunity.org.vn/wp-content/uploads/2021/10/Bookmark-days.jpg,32-6,035,Scot Gardner,Sách truyện người lớn,Lãng mạn,Allen & Unwin,"Avril falls in love for the first time with the boy next door, but his family and hers are bitter enemies, in this Romeo and Juliet story set in sheep farming country I've been driving the ute and the tractor since I was eleven. I get to sleep under the stars, help lambs into the world and ride my horse whenever I want.Avril Stanton has never been in love, until she meets Nathaniel, the boy from the farm next door. With his crazy hair and killer smile, he's perfect except for one detail - he's from the wrong side of the fence. Avril's family and Nathaniel's family have been feuding for two generations and aren't about to stop now. To follow her heart, Avril will have to stand up to her family. Will it be a Romeo-and-Juliet-style tragedy or will a thunderstorm, a car accident, and a couple of conniving grandmothers be able to solve her dilemma?",Từ 13 tuổi trở lên
1304,Brendan Buckley's sixth-grade experiment,https://lotuscommunity.org.vn/wp-content/uploads/2021/10/Brendan-Buckley_s-sixth-grade-experiment.jpg,33-3,034,Sundee Frazier,Sách truyện người lớn,Khoa học,Yearling,"Brendan Buckley's headed to middle school, and he has some big questions! Can he keep his new pet anole, Einstein, alive? Will his tough-as-rock Grandpa Ed and sharp-witted grandma, Gladys, butt heads or become friends? Most importantly, what will he propose for the national science competition his class is entering?
Then Brendan's alternative energy idea gets him paired with Morgan Belcher, a talkative, formerly homeschooled girl, whose eyes sparkle whenever Brendan is around. Though skeptical, Brendan decides to give Morgan a chance, and they embark on their project - a methane-producing experiment involving beakers, balloons, and the freshest cow manure they can find.
As Brendan spends more time on the experiment and faces new challenges, his big questions get even bigger: Will he and Khalfani always be best friends? Does Dad really think he's a science-nerd wimp? ",Từ 13 tuổi trở lên
1307,Bridget Jones's diary,https://lotuscommunity.org.vn/wp-content/uploads/2021/10/Bridget-Jones_s-diary.jpg,34-2,056,Helen Fielding,Sách truyện người lớn,Thực tế,Penguin Books,"Bridget Jones's Diary is the devastatingly self-aware, laugh-out-loud account of a year in the life of a thirty-something Singleton on a permanent doomed quest for self-improvement. Caught between the joys of Singleton fun, and the fear of dying alone and being found three weeks later half eaten by an Alsatian; tortured by Smug Married friends asking, ""How's your love life?"" with lascivious, yet patronizing leers, Bridget resolves to: reduce the circumference of each thigh by 1.5 inches, visit the gym three times a week not just to buy a sandwich, form a functional relationship with a responsible adult and learn to program the VCR. With a blend of flighty charm, existential gloom, and endearing self-deprecation, Bridget Jones's Diary has touched a raw nerve with millions of readers the world round. Read it and laugh - before you cry, ""Bridget Jones is me!""",Từ 13 tuổi trở lên
1318,Bronze and Sunflower,https://lotuscommunity.org.vn/wp-content/uploads/2021/10/Bronze-and-Sunflower.jpg,32-1,073,Cao Wenxuan,Sách truyện người lớn,Phiêu lưu,Candlewick Press,"A beautifully written, timeless tale by Cao Wenxuan, best-selling Chinese author and 2016 recipient of the prestigious Hans Christian Andersen Award.
Sunflower is an only child, and when her father is sent to the rural Cadre School, she has to go with him. Her father is an established artist from the city and finds his new life of physical labor and endless meetings exhausting. Sunflower is lonely and longs to play with the local children in the village across the river. When her father tragically drowns, Sunflower is taken in by the poorest family in the village, a family with a son named Bronze. Until Sunflower joins his family, Bronze was an only child, too, and hasn't spoken a word since he was traumatized by a terrible fire. Bronze and Sunflower become inseparable, understanding each other as only the closest friends can. Translated from Mandarin, the story meanders gracefully through the challenges that face the family, creating a timeless story of the trials of poverty and the power of love and loyalty to overcome hardship.",Từ 13 tuổi trở lên
1418,By sun and candlelight,https://lotuscommunity.org.vn/wp-content/uploads/2021/10/By-sun-and-candlelight.jpg,34-1,047,Shirley Hughes,Sách truyện người lớn,Truyền cảm hứng,"Hodder Children's Books
",A classic anthology of poems and writings for a lifetime by Shirley Hughes - the doyenne of the picture book world.,Từ 13 tuổi trở lên
1433,Call down thunder,https://lotuscommunity.org.vn/wp-content/uploads/2021/10/Call-down-thunder.jpg,33-3,065,Daniel Finn,Sách truyện người lớn,Tưởng tượng,Pan Macmillan,"A fast-paced, vividly rendered story of bravery, corruption, and survival
Reve and his sister Mi are alone in the world—their father is dead and their mother has abandoned them. Reve has to learn to be a man - to fight, to fish, to live. He must protect Mi from the rest of the world. She is special, hears voices, can see things. She can call down thunder. Traveling to the big city to search for their mother, Reve and Mi get sucked into the squalid underworld of the sprawling barrio, where danger lurks around every corner, and each day is a fight for survival.",Từ 13 tuổi trở lên
1512,Catwalk,https://lotuscommunity.org.vn/wp-content/uploads/2021/10/Catwalk.jpg,32-5,077,Deborah Gregory,Sách truyện người lớn,Thực tế,Audible Studios on Brilliance Audio,"In Catwalk, Deborah Gregory creates a new YA series that takes her famously upbeat urban voice and combines it with the appeal of Project Runway and America's Next Top Model.
Catwalk follows Pashmina, Felinez, Angora, and Aphro, four best friends at Manhattan's Fashion International High School who are about to enter the contest of their lives. Each year students split up into Fashion Houses and compete to Thiết kế, produce, and show fully original fashion lines. The winner gets a scholarship, a professional show, and a real shot at a career in fashion.

Bouncy, smart, and nearly irresistible, Catwalk is a fierce introduction to a fashion world where fabulosity trumps waist size, and there truly is room for everyone.",Từ 13 tuổi trở lên
1536,Chanakya's chant,https://lotuscommunity.org.vn/wp-content/uploads/2021/10/Chanakya_s-chant.jpg,33-2,021,Ashwin Sanghi,Sách truyện người lớn,Tưởng tượng,Westland,"Chanakya's Chant is a thrilling novel that tells its readers about a sharp parallel story between two individuals. One of these individuals is the very person who brought the scattered Indian subcontinent under the reign of Chandragupta Maurya-Chanakya. Chanakya is one of the wisest political strategists to have ever lived in the history of India. The second protagonist is Gangasagar Mishra, who is a rather insignificant Brahmin teacher, who seems to be struggling to make ends meet, but is actually a reincarnation of Chanakya himself.
The author gives you an intricately woven plot that is set in two parallel worlds, but is tied together by its two protagonists, namely Chanakya and Gangasagar. Chanakya's tale, set in 340BC, is a tale of revenge that Chanakya seeks against the king and how he brings in Chandragupta Maurya to take over the throne. The second tale, based in modern-day India is that of Gangasagar grooming a young girl from Kanpur, to eventually become the prime minister of India.
Will Chanakya's ingenious ways bring about a drastic turn in the events of the nation? This captivating book answers just that, through its exploration of Chanakya's ingenious and calculated moves that have altered the course of events in the past.",Từ 13 tuổi trở lên
1603,Children of the Lamp: the grave robbers of Genghis Khan,https://lotuscommunity.org.vn/wp-content/uploads/2021/10/Children-of-the-Lamp-the-grave-robbers-of-Genghis-Khan.jpg,33-5,075,P. B. Kerr,Sách truyện người lớn,Tưởng tượng,Scholastic ,"The final installment of bestselling P. B. Kerr's magical Children of the Lamp series. Djinn twins John and Philippa are off on another enchantingand dangerous, Phiêu lưu in the last book in the bestselling Children of the Lamp series. As volcanoes begin erupting all over the world, spilling golden lava, the twins must go on a hunt for the wicked djinn who wants to rob the grave of the great Genghis Khan. Can the twins stop this latest disaster before the world is overwhelmed? Join John and Philippa, their parents, Uncle Nimrodand Groanin as they must defeat an evil more powerful than any they've ever faced before.",Từ 13 tuổi trở lên
1614,Chip and Chase,https://lotuscommunity.org.vn/wp-content/uploads/2021/10/Chip-and-Chase.jpg,32-1,001,Billy Slater,Sách truyện người lớn,Tưởng tượng,Random House,"The fourth Billy Slater book finds one rugby player who can't keep up with his homework, and another looking for his chance to shine on the field.
Liam is the captain of the West Hill Ravens, and the heart and soul of the team. He lives, breathes, and sleeps rugby. The only problem is that it doesn’t leave him much time for anything else. Now his schoolwork is suffering, and his parents are on his back. He may even have to quit the team. And without their captain, the Ravens' chances of making the finals look grim. But team mentor Billy Slater has an idea - in the form of Ravi, the Ravens' inexperienced reserve player. If the two boys can work together, they may just save the team’s season.",Từ 13 tuổi trở lên
1725,Clone codes,https://lotuscommunity.org.vn/wp-content/uploads/2021/10/Clone-codes.jpg,33-2,011,Patricia McKissack,Sách truyện người lớn,Khoa học,Scholastic,"In the year 2170 an underground abolitionist movement fights for the freedom of cyborgs and clones, who are treated no better than slaves.
The Cyborg Wars are over and Earth has peacefully prospered for more than one hundred years. Yet sometimes history must repeat itself until humanity learns from its mistakes. In the year 2170, despite technological and political advances, cyborgs and clones are treated no better than slaves, and an underground abolitionist movement is fighting for freedom. Thirteen-year-old Leanna's entire life is thrown into chaos when The World Federation of Nations discovers her mom is part of the radical Liberty Bell Movement.",Từ 13 tuổi trở lên
1737,Club CSI: the case of the plagued play,https://lotuscommunity.org.vn/wp-content/uploads/2021/10/Club-CSI-the-case-of-the-plagued-play.jpg,34-6,076,David Lewman,Sách truyện người lớn,Bí ẩn,"Simon Spotlight
","The school play is in danger of closing before it even opens if Club CSI: can’t figure out who’s ruining rehearsals!
Someone is trying to sabotage the school play, and it’s up to Hannah, Ben, and Corey to make sure the show goes on. Club CSI: learns that the play was written by an eighth grader at Woodlands Junior High… Is the culprit a jealous classmate? Or could a disgruntled actor be to blame? As more props go missing and the set is vandalized, Club CSI: must use all of the investigation and forensic science techniques in their arsenal to crack the case. Because if they don’t, the play’s final curtain call might happen before opening night!",Từ 13 tuổi trở lên
1779,Complete nonsense,https://lotuscommunity.org.vn/wp-content/uploads/2021/10/Complete-nonsense.jpg,32-6,061,Edward Lear,Sách truyện người lớn,Thực tế,Dover Publications,"Here is every line of every nonsense book written by Edward Lear. In a single volume you get ""A Book of Nonsense,"" ""Nonsense Songs,"" ""More Nonsense Songs,"" ""Laughable Lyrics,"" and ""Nonsense Songs and Stories. No other low-price edition offers this complete collection.
You will meet such old favorites as ""The Dong With a Luminous Nose,"" ""The Jumblies,"" ""The Owl and the Pussycat,"" ""The Nutcrackers and the Sugar Tongs,"" and ""The History of the Seven Young Owls."" Two hundred and fourteen limericks are in here as well, each illustrated with the drawing Lear composed specially for it. In addition, you'll find three different sets of Nonsense Botany, five Nonsense Alphabets, and dozens of other selections in both prose and verse.",Từ 13 tuổi trở lên
1953,Crow country,https://lotuscommunity.org.vn/wp-content/uploads/2021/10/Crow-country.jpg,33-5,071,Kate Constable,Sách truyện người lớn,Bí ẩn,Allen & Unwin,"From the author of the Chanters of Tremaris series comes a contemporary time travel Tưởng tượng, grounded in the landscape of Australia
Beginning and ending, always the same, always now. The game, the story, the riddle, hiding and seeking. Crow comes from this place; this place comes from Crow. And Crow has work for you.
Sadie isn't thrilled when her mother drags her from the city to live in the country town of Boort. But soon she starts making connections—with the country, with the past, with two boys, Lachie and Walter, and, most surprisingly, with the ever-present crows. When Sadie is tumbled back in time to view a terrible crime, she is pulled into a strange Bí ẩn. Can Sadie, Walter, and Lachie figure out a way to right old wrongs, or will they be condemned to repeat them? A Tưởng tượng ground in mythology, this novel has the backing of a full consultative process on the use of indigenous lore.",Từ 13 tuổi trở lên
2156,Dinosaurology,https://lotuscommunity.org.vn/wp-content/uploads/2021/10/Dinosaurology.jpg,34-1,010,Raleigh Rimes,Sách truyện người lớn,Khoa học,Candlewick,"Could dinosaurs still roam the earth? With this discovery in the ’Ology series, readers come face-to-face with living, breathing dinosaurs.
What if dinosaurs had not died out? What if whole colonies of the prehistoric beasts had survived on a remote island off the coast of South America? This Phiêu lưu in the best-selling ’Ology series offers young dinosaur lovers a tantalizing taste of what that would be like. The year is 1907, and young Phiêu lưur Raleigh Rimes is on an expedition to South America with real-life explorer Percy Fawcett. There he discovers the unimaginable: living dinosaurs roaming the rain forest! Presented as a journal detailing their extraordinary (and hairraising) encounters with the amazing beasts — fearsome Tyrannosaurus rex, pack-hunting allosauruses, predatory velociraptors, armored triceratops, and other species — Dinosaurology is filled with flaps and booklets offering dinosaur lore, along with such novelties as a sample of dinosaur skin, a pouch of ground stegosaurus horn, and more.",Từ 13 tuổi trở lên
