Title,Images,Shelflist,Position,Author,Category,SubCategory,Publisher,Description,Tags
Prince of Persia: the sands of time,https://lotuscommunity.org.vn/wp-content/uploads/2022/10/Prince-of-Persia-the-sands-of-time.jpg,21-2,062,James Ponti,Sách truyện thiếu nhi,10-12 tuổi,Disney Press,"When a young prince (Jake Gyllenhaal) is framed for the death of his beloved father and the king of Persia, he must prove his innocence with the reluctant help of a conquered princess (Gemma Arterton) and a magic dagger that can reverse time. The junior novel is a retelling of the film and will include an eight-page full-color photo insert with pictures from the film.",10-12 tuổi
Puzzle adventure omnibus,https://lotuscommunity.org.vn/wp-content/uploads/2022/10/Puzzle-adventure-omnibus.jpg,20-4,063,Usborne,Sách truyện thiếu nhi,10-12 tuổi,Usborne Publishing,This omnibus contains the first seven titles in Usborne's 'Puzzle Adventure Series'. There are clues to help you if you get stuck along the way and answers at the end of each story.,10-12 tuổi
Soccer Sam,https://lotuscommunity.org.vn/wp-content/uploads/2022/10/Soccer-Sam.jpg,7-5,066,Jean Marzollo,Sách truyện thiếu nhi,7-9 tuổi,Random House,"In a perceptive tale of friendship and sports, this multicultural early reader shows how Sam's visiting Mexican cousin overcomes the language barrier by teaching soccer to his new friends.",7-9 tuổi
Stories of princes and princesses,https://lotuscommunity.org.vn/wp-content/uploads/2022/10/Stories-of-princes-and-princesses.jpg,7-5,063,Christopher Rawson,Sách truyện thiếu nhi,7-9 tuổi,Usborne,"Four original stories about princes and princesses for children just beginning to learn how to read. Meet clumsy princes, stubborn princesses and a rather pongy prince named Percy in these highly amusing stories. Usborne Young Reading has been developed with reading experts from Roehampton University.",7-9 tuổi
Swiss Family Robinson,https://lotuscommunity.org.vn/wp-content/uploads/2022/10/Swiss-Family-Robinson.jpg,20-4,060,Johann Wyss,Sách truyện thiếu nhi,10-12 tuổi,Signet,"Swept off course by a raging storm, a Swiss pastor, his wife, and their four young sons are shipwrecked on an uncharted tropical island. Thus begins the classic story of survival and adventure that has fired the imaginations of readers since it first appeared in 1812. With optimism and boundless enthusiasm, the Robinson family undertakes the extraordinary task of constructing a home for themselves and exploring the primitive island filled with strange and beautiful creatures and exotic fruits and plants. Rich in action and suspense, The Swiss Family Robinson is an exhilarating novel takes us to a faraway place of danger and beauty, where the courageous Robinson family embarks on a thrilling new life of adventure and discovery.",10-12 tuổi
The adventurous four: shipwrecked,https://lotuscommunity.org.vn/wp-content/uploads/2022/10/The-adventurous-four-shipwrecked.jpg,19-2,063,Enid Blyton,Sách truyện thiếu nhi,10-12 tuổi,Award Publications,"When a trip at Little Island for the weekend ends in them being shipwrecked, it is at first exciting for the Adventurous Four. But imagine their surprise when they discover the hidden harbour is full of enemy submarines! They investigate more closely so as to get back to the mainland and expose this terrible enemy. But a forgotten camera leads to their capture. How can they outsmart the enemy and escape? And is there any way of getting off the island...?",10-12 tuổi
The adventurous four: stranded,https://lotuscommunity.org.vn/wp-content/uploads/2022/10/The-adventurous-four-stranded.jpg,19-2,059,Enid Blyton,Sách truyện thiếu nhi,10-12 tuổi,Award Publications,"Four children set off on a short trip to Smugglers Lock and find a mysterious stranger there.When the stranger discovers them following him he takes away their boat and maroons them on the rock. Theres no chance of escape without a boat, and its completely disappeared what are the children going to do.",10-12 tuổi
The amazing adventures on turtle pond,https://lotuscommunity.org.vn/wp-content/uploads/2022/10/The-amazing-adventures-on-turtle-pond.jpg,20-4,062,Margaret Wells,Sách truyện thiếu nhi,10-12 tuổi,FriesenPress,"Summer is an exciting time on Turtle Pond. What adventures will one family of turtles - Daddy Burtle, Mummy Myrtle, Hurtle, and Squirtle - have together? From a close encounter with a dangerous bird, a day out at the spa to a scary storm and a talent show at school, life on the pond is always busy! Young readers will enjoy these fun stories while they discuss interesting questions, learn important lessons, and discover new vocabulary.",10-12 tuổi
The crocodile brother and other folk tales,https://lotuscommunity.org.vn/wp-content/uploads/2022/10/The-crocodile-brother-and-other-folk-tales.jpg,19-4,064,Bob Hartman,Sách truyện thiếu nhi,10-12 tuổi,Lion UK,"Part of the Storyteller Tales series, this title contains some of master storyteller Bob Hartman's best-loved folk and traditional tales. The contents are derived from The lion storyteller bedtime book and The lion storyteller book of animal tales, and this collection contains more than half a dozen folk tales from around the world.",10-12 tuổi
The doll people,https://lotuscommunity.org.vn/wp-content/uploads/2022/10/The-doll-people.jpg,20-4,058,Ann M. Martin,Sách truyện thiếu nhi,10-12 tuổi,Little Brown Books for Young Readers,"The 100-year-old Doll family, beautifully crafted china dolls passed down through four generations of girls in one American family, meet their new neighbors, the Funcrafts, a doll family made completely of plastic and delivered straight from the factory shelves.
Annabelle Doll is eight years old. She has been for over 100 years. Not a lot has happened to her, cooped up in the dollhouse, with the same doll people, day after day, year after year...until the Funcrafts move in. Now Annabelle has a friend. Sure, she's made entirely of plastic and she's living in the scariest room in the house, but she's an adventurer, and after 100 years of boredom, that's just what Annabelle needs.",10-12 tuổi
The donkey tragedy: moral stories,https://lotuscommunity.org.vn/wp-content/uploads/2022/10/The-donkey-tragedy-moral-stories.jpg,7-2,078,Manoj Publications,Sách truyện thiếu nhi,7-9 tuổi,Manoj Publications,This book covers all the parts in a very easy language which makes it even more interesting for the readers.,7-9 tuổi
The mystery of the banshee towers,https://lotuscommunity.org.vn/wp-content/uploads/2022/10/The-mystery-of-the-banshee-towers.jpg,19-4,065,Enid Blyton,Sách truyện thiếu nhi,10-12 tuổi,Mammoth,"Ern is back visiting Mr Goon, which gives him and the Find-Outers the perfect chance to explore Banshee Towers. But there's more secrets to the towers than the screaming banshees. Fatty, Larry, Daisy, Pip, Bets and Buster the Dog have one last case to solve...",10-12 tuổi
The mystery of the spiteful letters,https://lotuscommunity.org.vn/wp-content/uploads/2022/10/The-mystery-of-the-spiteful-letters.jpg,19-2,064,Enid Blyton,Sách truyện thiếu nhi,10-12 tuổi,Egmont Childrens,"An adventure for the Five Find-Outers and their dog. Fatty, Larry, Daisy, Pip, Bets and Buster become involved in a very peculiar situation when a series of unsigned letters are sent to various people in Peterswood.",10-12 tuổi
The Princess Diaries: third time lucky,https://lotuscommunity.org.vn/wp-content/uploads/2022/10/The-Princess-Diaries-third-time-lucky.jpg,21-2,061,Meg Cabot,Sách truyện thiếu nhi,10-12 tuổi,Pan MacMillan,"Mia's got everything a girl could possibly want. She's a princess and she's got a boyfriend! But that's where it all goes wrong. Because Kenny is just not the guy she really wants. Michael's the one she's loved forever but he's going out with someone infinitely cleverer than Mia. Someone who can clone fruit flies, for heaven's sake! Will the story end happily ever after for the Princess of Genovia?",10-12 tuổi
The secret of Cliff Castle,https://lotuscommunity.org.vn/wp-content/uploads/2022/10/The-secret-of-Cliff-Castle.jpg,20-4,057,Enid Blyton,Sách truyện thiếu nhi,10-12 tuổi,Award Childrens Books,"As soon as Peter, Pam and their cousin Brock hear about the strange castle by the sea they are determined to solve its mystery, but an unknown enemy awaits them in the castle's secret and ghostly passages.",10-12 tuổi
The story of castles,https://lotuscommunity.org.vn/wp-content/uploads/2022/10/The-story-of-castles.jpg,7-2,080,Lesley Sims,Sách truyện thiếu nhi,7-9 tuổi,Usborne,"Outlines the development of medieval castles, and describes what life was like for the people living in them.",7-9 tuổi
The story of chocolate,https://lotuscommunity.org.vn/wp-content/uploads/2022/10/The-story-of-chocolate.jpg,7-5,061,Katie Daynes,Sách truyện thiếu nhi,7-9 tuổi,Usborne,"The fascinating history of chocolate, from its origins in the rainforests of Central America to shops and factories everywhere. Written as part of the Usborne Young Reading Programme, designed for children just beginning to read.",7-9 tuổi
The sweetest spring,https://lotuscommunity.org.vn/wp-content/uploads/2022/10/The-sweetest-spring.jpg,3-5,016,Disney,Sách truyện thiếu nhi,3-6 tuổi,Disney,"Share the sweetness of spring with Cinderella, Ariel, and all the Disney Princesses in this fun and bouncy Step 2 reader. This delightful story with bright and beautiful illustrations will have budding young princess fans blossoming into wonderful readers.",3-6 tuổi
The wizard of Oz,https://lotuscommunity.org.vn/wp-content/uploads/2022/10/The-wizard-of-Oz.jpg,20-4,059,L. Frank Baum,Sách truyện thiếu nhi,10-12 tuổi,Penguin Popular Classics,"Dorothy thinks she's lost forever when a tornado whirls her and her dog, Toto, into a magical world. To get home, she must find the wonderful wizard in the Emerald City of Oz. On the way she meets the Scarecrow, the Tin Woodman and the Cowardly Lion. But the Wicked Witch of the West has her own plans for the new arrival... will Dorothy ever see Kansas again?",10-12 tuổi
The world on her knees,https://lotuscommunity.org.vn/wp-content/uploads/2022/10/The-world-on-her-knees.jpg,3-5,008,R. Chandran,Sách truyện thiếu nhi,3-6 tuổi,J.J. Pub.,"This is a story of a little baby girl wondering what the view is like from her parents' perspective when she has yet to learn how to stand and is still crawling on her knees, is suddenly entrusted with a hero's task.",3-6 tuổi
This is my dance,https://lotuscommunity.org.vn/wp-content/uploads/2022/10/This-is-my-dance.jpg,3-5,014,Susan James,Sách truyện thiếu nhi,3-6 tuổi,"Kindermusik International
",Mama bear and baby dance together. Personalize the book with your baby's name.,3-6 tuổi
Thomas and the school trip,https://lotuscommunity.org.vn/wp-content/uploads/2022/10/Thomas-and-the-school-trip.jpg,7-5,064,Random House,Sách truyện thiếu nhi,7-9 tuổi,Random House,That cheeky blue engine refuses to be sidetracked from his goal of taking schoolchildren home after their visit to the train yard--despite a host of obstacles along the way.  ,7-9 tuổi
Too many books,https://lotuscommunity.org.vn/wp-content/uploads/2022/10/Too-many-books.jpg,7-5,072,Gilles Tibo,Sách truyện thiếu nhi,7-9 tuổi,Scholastic ,"Every time Nicolas tries to do something, people give him a book. Now, he has so many books that tell him what to do, how to do it and why to do it that he can't stand them anymore! But could books also be fun?",7-9 tuổi
Two of a kind diaries: calling all boys,https://lotuscommunity.org.vn/wp-content/uploads/2022/10/Two-of-a-kind-diaries-calling-all-boys.jpg,19-4,061,Megan Stine,Sách truyện thiếu nhi,10-12 tuổi,Harper Entertainment ,"Mary-Kate gets a beautiful beaded necklace from her Secret Santa. She thinks it's from Carter, a really cute boy in one of her classes. Could Carter have a crush on her? Ashley gets the worst presents ever from her Secret Santa - stinky gym socks and a half-eaten sandwich! Her Secret Santa must really not like her. And Ashley has the feeling it's one of her friends!",10-12 tuổi
Two of a kind diaries: winner takes all,https://lotuscommunity.org.vn/wp-content/uploads/2022/10/Two-of-a-kind-diaries-winner-takes-all.jpg,19-4,060,Megan Stine,Sách truyện thiếu nhi,10-12 tuổi,Harper Entertainment ,"Dear Diary, Today was the worst day of my life. I tried out for the White Oak softball team, and it was a total disaster. I couldn't do anything right. I never even made it to the first base. I missed a fly ball. And I struck out - six times in a row!

But that's not the worst thing. Ashley is the new gossip columnist for the school paper - and she wrote something about me. Something I didn't want anyone else to know!",10-12 tuổi
Two of a kind: let's party,https://lotuscommunity.org.vn/wp-content/uploads/2022/10/Two-of-a-kind-let_s-party.jpg,19-2,060,Megan Stine,Sách truyện thiếu nhi,10-12 tuổi,Harper Entertainment ,"Ashley has a great idea! She's going to give a surprise party for her friend Jennifer. But Ashley gets a surprise, too - when she finds out that Mary - Kate is giving another party for her best friend Amanda on the same night!

But the biggest shocker of all is the one Dad has for both of the girls - one that's going to change their lives big-time!",10-12 tuổi
"Well, really, Mr Twiddle",https://lotuscommunity.org.vn/wp-content/uploads/2022/10/Well-really-Mr-Twiddle.jpg,19-2,065,Enid Blyton,Sách truyện thiếu nhi,10-12 tuổi,Bloomsbury Publishing,"Mr Twiddle is a kind old man who means to do his best, but he is often forgetful, a bit lazy and sometimes very silly. Poor Mrs Twiddle is driven to distraction by his muddles.

This time he goes out for a late night walk with the dog, but ends up taking a goose home instead!",10-12 tuổi
What is thanksgiving?,https://lotuscommunity.org.vn/wp-content/uploads/2022/10/What-is-Thanksgiving.jpg,3-5,010,Harriet Ziefert,Sách truyện thiếu nhi,3-6 tuổi,HarperFestival;,"By helping her parents prepare a huge Thanksgiving feast for a large and loving extended family, Little Mouse gets a hands-on introduction to the holiday - and so will young readers as they lift the flaps to join in the fun of the mouse family's Thanksgiving celebration.
",3-6 tuổi
What makes a rainbow,https://lotuscommunity.org.vn/wp-content/uploads/2022/10/What-makes-a-rainbow.jpg,3-5,013,Betty Schwartz,Sách truyện thiếu nhi,3-6 tuổi,Piggy Toes Pr,A rainbow of ribbons magically appear when you open the pages of this innovative book! Toddlers will love listening to the charming story and seeing a different colored ribbon with the turn of each page. The last page is sure to delight with all the colors of the rainbow. What a fun way to learn colors!,3-6 tuổi
What's the Earth made of,https://lotuscommunity.org.vn/wp-content/uploads/2022/10/What_s-the-Earth-made-of.jpg,26-6,071,Usborne,Sách tham khảo,Hành tinh của chúng ta,Usborne Publishing Ltd,"Each book in this bright, exciting series for young children introduces an aspect of the natural or technological world, providing a wealth of fascinating information. The series explores a wide variety of subjects such as what makes your tummy rumble, how a car is made, why flamingos are pink and how earthquakes happen. Where it is appropriate, there are safe and easy experiments to help clarify explanations.

The simple text and detailed illustrations combine to answer the question of each title in clear, step-by-step stages. Young children who are just beginning to read will enjoy sharing these books with an adult, while more confident readers will have fun discovering for themselves.",Hành tinh của chúng ta
Where's Wally: the totally essential travel collection,https://lotuscommunity.org.vn/wp-content/uploads/2022/10/Where_s-Wally-the-totally-essential-travel-collection.jpg,19-2,061,Martin Handford,Sách truyện thiếu nhi,10-12 tuổi,Walker Books,"All the wondrous Wally worlds in one, with gold foiled stripes on the cover, an elastic close and six postcards to colour in and send to your friends. Wherever you're going, however you're travelling – join the spectacular search for Wally. Wow! Have YOU found Wally yet?",10-12 tuổi