Title,Images,Shelflist,Position,Author,Category,SubCategory,Publisher,Description,Tags
A wrinkle in time,https://lotuscommunity.org.vn/wp-content/uploads/2022/10/A-wrinkle-in-time.jpg,19-2,058,Madeleine L'Engle,Sách truyện thiếu nhi,10-12 tuổi,Square Fish,"Out of this wild night, a strange visitor comes to the Murry house and beckons Meg, her brother Charles Wallace, and their friend Calvin O'Keefe on a most dangerous and extraordinary adventure - one that will threaten their lives and our universe.
Winner of the 1963 Newbery Medal, A Wrinkle in Time is the first book in Madeleine L'Engle's classic Time Quintet.",10-12 tuổi
Amber the ambulance,https://lotuscommunity.org.vn/wp-content/uploads/2022/10/Amber-the-ambulance.jpg,3-5,011,Brimax,Sách truyện thiếu nhi,3-6 tuổi,Brimax ,"Meet Hannah the Helicopter, Paul the Police Car, Amber the Ambulance and Finn the Fire Engine in these engaging cased board books. Each character faces an emergency situation and shows exactly what to do. The final spread shows children what they need to do in an emergency situation and how to call emergency services.",3-6 tuổi
Anne of Green Gables,https://lotuscommunity.org.vn/wp-content/uploads/2022/10/Anne-of-Green-Gables.jpg,20-4,061,L. M. Montgomery,Sách truyện thiếu nhi,10-12 tuổi,Signet Book,"This heartwarming story has beckoned generations of readers into the special world of Green Gables, an old-fashioned farm outside a town called Avonlea. Anne Shirley, an eleven-year-old orphan, has arrived in this verdant corner of Prince Edward Island only to discover that the Cuthberts - elderly Matthew and his stern sister, Marilla - want to adopt a boy, not a feisty redheaded girl. But before they can send her back, Anne - who simply must have more scope for her imagination and a real home - wins them over completely. A much-loved classic that explores all the vulnerability, expectations, and dreams of a child growing up, Anne of Green Gables is also a wonderful portrait of a time, a place, a family… and, most of all, love.",10-12 tuổi
Big hero 6: fight to the finish,https://lotuscommunity.org.vn/wp-content/uploads/2022/10/Big-hero-6-I-am-Baymax.jpg,7-2,075,Random House,Sách truyện thiếu nhi,7-9 tuổi,Random House ,"Big Hero 6 features brilliant robotics prodigy Hiro Hamada, who finds himself in the grips of a criminal plot that threatens to destroy the fast-paced, high-tech city of San Fransokyo. With the help of his closest companion - a robot named Baymax - Hiro joins forces with a reluctant team of first-time crime-fighters on a mission to save their city. Boys and girls ages 5 to 8 will love this Step 3 Step into Reading reader based on the film!",7-9 tuổi
Big hero 6: I am Baymax,https://lotuscommunity.org.vn/wp-content/uploads/2022/10/Big-hero-6-the-big-battle.jpg,7-2,076,Random House,Sách truyện thiếu nhi,7-9 tuổi,Random House ,"A Step 2 Step into Reading reader about Big Hero 6 and the mysterious villain Yokai. From Walt Disney Animation Studios comes Big Hero 6, a comedy-adventure about brilliant robotics prodigy Hiro Hamada, who finds himself in the grips of a criminal plot that threatens to destroy the fast-paced, high-tech city of San Fransokyo. Boys ages 4 to 6 will love this Step 2 Step into Reading leveled reader!",7-9 tuổi
Big hero 6: the big battle,https://lotuscommunity.org.vn/wp-content/uploads/2022/10/Big-hero-6-fight-to-the-finish.jpg,7-2,074,Random House,Sách truyện thiếu nhi,7-9 tuổi,Random House ,"Big Hero 6 features brilliant robotics prodigy Hiro Hamada, who finds himself in the grips of a criminal plot that threatens to destroy the fast-paced, high-tech city of San Fransokyo. With the help of his closest companion - a robot named Baymax - Hiro joins forces with a reluctant team of first-time crime fighters on a mission to save their city. Boys and girls ages 5 to 8 will love this Step 3 Step into Reading leveled reader, which includes a set of battle cards featuring the heroes and villains of Big Hero 6!",7-9 tuổi
Biscuit's day at the farm,https://lotuscommunity.org.vn/wp-content/uploads/2022/10/Biscuit_s-day-at-the-farm.jpg,2-5,014,Alyssa Satin Capucilli,Sách truyện thiếu nhi,0-2 tuổi,HarperCollins,"Biscuit is going to help out on the farm today and can’t wait to feed all of the farm animals. He makes friends with the hens, the geese, and even an eager little piglet who wants to follow him everywhere!  ",0 - 2 tuổi
Bunny loves to write,https://lotuscommunity.org.vn/wp-content/uploads/2022/10/Bunny-loves-to-write.jpg,7-2,072,Peter Bently,Sách truyện thiếu nhi,7-9 tuổi,Parragon Books,"Buster Bunny loves to read. And when hes given a notebook and pencil, he discovers that he loves to write, too! Children are encouraged to use their imagination and creativity in this exciting picture book with a story and doodles by Buster himself.",7-9 tuổi
California diaries,https://lotuscommunity.org.vn/wp-content/uploads/2022/10/California-diaries.jpg,7-2,079,Ann M. Martin,Sách truyện thiếu nhi,7-9 tuổi,Scholastic ,"Having moved away from California, Dawn Shafer experiences a number of unsettling changes at once, including new relationships with friends, family, and her stepfamily, and she finds herself redefining her identity. ",7-9 tuổi
Captain Underpants and the preposterous plight of the purple potty people,https://lotuscommunity.org.vn/wp-content/uploads/2022/10/Captain-Underpants-and-the-preposterous-plight-of-the-purple-potty-people.jpg,19-4,063,Dav Pilkey,Sách truyện thiếu nhi,10-12 tuổi,Scholastic,"eorge and Harold's time-traveling Purple Potty lands them in a crazy place in the eighth book in this #1 New York Times bestselling series by Dav Pilkey, the author and illustrator of Dog Man!
The teachers are nice, the cafeteria serves delicious food, and the school principal, Mr. Krupp, thinks George and Harold are hilarious. Something is very, very wrong - and it gets even wronger when the boys' pet pterodactyl, Crackers, and Sulu the Bionic Hamster are captured by George and Harold's evil-twin look-alikes. Now George and Harold must face their greatest foes yet: themselves! Can they handle this mess on their own, or will they need Captain Underpants to swoop in and save the day?",10-12 tuổi
Christmas stories,https://lotuscommunity.org.vn/wp-content/uploads/2022/10/Christmas-stories.jpg,7-5,071,Brown Watson,Sách truyện thiếu nhi,7-9 tuổi,Brown Watson,"This perfect holiday-themed lullaby is filled with good wishes and as much happiness, cheer, and joy as there is on Christmas Day.",7-9 tuổi
Daisy Jane: best-ever flower girl,https://lotuscommunity.org.vn/wp-content/uploads/2022/10/Daisy-Jane-best-ever-flower-girl.jpg,3-5,015,Megan McDonald,Sách truyện thiếu nhi,3-6 tuổi,Random House Books for Young Readers,"Daisy Jane loves her favorite babysitter, Allie. So when Allie asks Daisy Jane to be her flower girl, the obvious answer is yes. When the big day arrives, Daisy Jane shows everyone that she is the best-ever flower girl.",3-6 tuổi
DC Comics: the ultimate character guide,https://lotuscommunity.org.vn/wp-content/uploads/2022/10/DC-Comics-the-ultimate-character-guide.jpg,19-2,062,DK,Sách truyện thiếu nhi,10-12 tuổi,DK Children,"Is Superman the strongest Super Hero alive? Where is Wonder Woman from? Is Darkseid the most evil Super-Villain ever? Who is the fastest man alive? Who are Batman's allies?

Have to know the answers to these questions? Look no further than the DC Comics Ultimate Character Guide: New Edition. Written by DC Comics experts, this illustrated encyclopedia features more than 200 incredible characters and Super Hero teams, including Batman, Harley Quinn, Justice League, and so many more.",10-12 tuổi
Dora climbs Star Mountain,https://lotuscommunity.org.vn/wp-content/uploads/2022/10/Dora-climbs-Star-Mountain.jpg,3-5,005,Alison Inches,Sách truyện thiếu nhi,3-6 tuổi,"
Simon & Schuster Children's","Dora loves her new necklace. But then Swiper swipes it and throws it all the way to the top of Star Mountain! Dora and Boots journey to the top of the mountain to get it back, and along the way they encounter fog, falling rocks, and green goo! It's a good thing the Explorer Stars are there to help! Based on a special episode.",3-6 tuổi
Fancy Nancy: the dazzling book report,https://lotuscommunity.org.vn/wp-content/uploads/2022/10/Fancy-Nancy-the-dazzling-book-report.jpg,7-5,065,Jane O'Connor,Sách truyện thiếu nhi,7-9 tuổi,HarperCollins,"Nancy's first book report is sure to be dazzling. After all, she is the second-best artist in her class. She is using beads, fringe, and a fancy border. And she is writing about Sacajawea, a true-life heroine. What could go wrong?",7-9 tuổi
Frozen: babysitting the troll tots,https://lotuscommunity.org.vn/wp-content/uploads/2022/10/Frozen-babysitting-the-troll-tots.jpg,7-2,077,Disney,Sách truyện thiếu nhi,7-9 tuổi,Disney Press,"Anna and Kristoff are asked to babysit the troll tots. But the more they try, the wilder the tots become! Will the troll tots ever go to sleep?",7-9 tuổi
Geronimo Stilton: dinosaurs in action,https://lotuscommunity.org.vn/wp-content/uploads/2022/10/Geronimo-Stilton-dinosaurs-in-action.jpg,20-4,064,Geronimo Stilton,Sách truyện thiếu nhi,10-12 tuổi,Papercutz,"The Pirate Cats have had their plans foiled by Geronimo Stilton time and time again, due to the help from Geronimo’s friend Professor Volt. The Pirate Cats decide to better their odds by getting rid of Professor Volt, kidnapping him and leaving him in the Cretaceous Period - a time when the earth was occupied by dinosaurs! Geronimo and his friends must travel back in time 140 million years to save Professor Volt from literally becoming a part of history!",10-12 tuổi
Geronimo Stilton: Geronimo Stilton saves the Olympics,https://lotuscommunity.org.vn/wp-content/uploads/2022/10/Geronimo-Stilton-Geronimo-Stilton-saves-the-Olympics.jpg,21-2,065,Geronimo Stilton,Sách truyện thiếu nhi,10-12 tuổi,Papercutz,"Just in time for the Olympics this summer! Athens, Greece: the first Olympic Games are about to take place, and the Pirate Cats have traveled back in time to enter the competition. The fiendish felines plan to win as many events as they can, and become legendary athletes. But these cats aren't exactly in playing shape! In order to gain an edge, they bring all sorts of modern-age sports gear to improve their odds of winning. It's up to Geronimo and the gang to foil their scheme and save history.",10-12 tuổi
Happy days: Merry Mister Meddle,https://lotuscommunity.org.vn/wp-content/uploads/2022/10/Happy-days-Merry-Mister-Meddle.jpg,19-4,059,Enid Blyton,Sách truyện thiếu nhi,10-12 tuổi,Award Publications,"Poor Mister Meddle is a very merry pixie always willing to help out and do good deeds, but he never quite gets it right. One day his meddling gets him into trouble with Aunt Jemima - he serves her up a treacle pudding covered in glue and gets chased home by a Biggle-Gobble.",10-12 tuổi
I can,https://lotuscommunity.org.vn/wp-content/uploads/2022/10/I-can.jpg,2-5,013,Ben Lai,Sách truyện thiếu nhi,0-2 tuổi,Epiphany Arts ,"Embark on a journey of discovery around Singapore as you learn about the island nation's most famous landmarks and icons.

The story stars a young girl who proudly proclaims ""I can"" as she engages in fun activities and interacts with these places and objects. Let your young one build a sense of ableness and independence through these colourful pages. ",0-2 tuổi
Jack and the beanstalk,https://lotuscommunity.org.vn/wp-content/uploads/2022/10/Jack-and-the-beanstalk.jpg,7-5,062,Ladybird,Sách truyện thiếu nhi,7-9 tuổi,"Ladybird Books
","Jack got some magic beans that grew into a giant beanstalk! When Jack climbed the beanstalk, what did he find at the top of it?",7-9 tuổi
Journey to Jo'Burg,https://lotuscommunity.org.vn/wp-content/uploads/2022/10/Journey-to-Jo_Burg.jpg,19-4,062,Beverley Naidoo,Sách truyện thiếu nhi,10-12 tuổi,HarperCollins Children's Books,"This is the story of love, commitment and the flowering of the human spirit against the background of South Africa's apartheid. Frightened that their baby sister Dineo will die, thirteen-year-old Naledi and her younger brother Tiro run away from their grandmother to Johannesburg to find their mother, who works there as a maid. Their journey illustrates at every turn the grim realities of apartheid - the pass laws, bantustans, racism, the breakdown of family life. The opulence of the white ""Madam's"" house contrasts starkly with the reality that Naledi and Tiro face - that their baby sister is suffering from starvation, not an incurable disease. ",10-12 tuổi
Little women,https://lotuscommunity.org.vn/wp-content/uploads/2022/10/Little-women.jpg,7-2,073,Usborne,Sách truyện thiếu nhi,7-9 tuổi,Usborne,"A re-telling of the beloved Louisa May-Alcott story for younger children. The inspirational story follows the fortunes of the March sisters as they struggle through the American Civil War and learn the importance of love, family and following their dreams. Usborne Young Reading has been developed with reading experts from Roehampton University. Series 3 is for confident readers. Sturdy hardback and ribbon marker make this incredible value for money.",7-9 tuổi
Lola is very creative,https://lotuscommunity.org.vn/wp-content/uploads/2022/10/Lola-is-very-creative.jpg,7-5,076,Nuria Roca,Sách truyện thiếu nhi,7-9 tuổi,Gemser Publications,"Have you ever realized how many things you can make with your hands? And how many things you can invent using your imagination? There are many ways to create. You can sew, make sculptures, draw, paint, dance, style, write stories and sing... Surely, you, who are very creative, already do many of these things! To be creative, you simply need to be very curious about everything there is around you.",7-9 tuổi
Marmee's surprise,https://lotuscommunity.org.vn/wp-content/uploads/2022/10/Marmee_s-surprise.jpg,7-5,069,Monica Kulling,Sách truyện thiếu nhi,7-9 tuổi,Random House,"Each of the four March sisters is special in her own unique way. Meg is a dreamer, Jo is a tomboy, Beth is shy and thoughtful, and Amy is a bundle of energy. But despite their differences, the girls pull together to get through a difficult winter holiday. Based on the first chapter of the enduring classic Little Women, this enchanting retelling will introduce a new generation of ""little women"" to the works of Louisa May Alcott. ",7-9 tuổi
Mary had a little lamb,https://lotuscommunity.org.vn/wp-content/uploads/2022/10/Mary-had-a-little-lamb.jpg,2-5,012,Igloo Books,Sách truyện thiếu nhi,0-2 tuổi,Igloo Books,"This Mary had a little lamb sounds book is ideal for singing along to the classic song and completing all the actions that go along with it. A great way to encourage a love of reading, little ones will adore this new addition to their bookshelves.",0-2 tuổi
Mr Pink-Whistle's party,https://lotuscommunity.org.vn/wp-content/uploads/2022/10/Mr-Pink-Whistle_s-party.jpg,21-2,064,Enid Blyton,Sách truyện thiếu nhi,10-12 tuổi,Award Childrens Books,"Mr Pink-Whistle is a little fat man with pointed brownie ears and large green eyes; but really he is neither human nor brownie. Until Mr Pink-Whistle decided to use his special talent of making himself invisible, his only friend was his cat, Sooty. But things have now changed.",10-12 tuổi
My animal kingdom: tigers,https://lotuscommunity.org.vn/wp-content/uploads/2022/10/My-animal-kingdom-tigers.jpg,23-2,083,Brown Watson,Sách tham khảo,Động vật,"Brown Watson
","Discover the amazing world of tigers with the help of two cuddly, new friends, Tina and Timothy.",Động vật
My big animal book,https://lotuscommunity.org.vn/wp-content/uploads/2022/10/My-big-animal-book.jpg,3-5,021,Roger Priddy,Sách truyện thiếu nhi,3-6 tuổi,Priddy Books,"On the big, sturdy board pages, they'll discover bright, bold photographs of all different kinds of animals, from pets to farm animals to birds. Each has their name written underneath, so that children can learn what they're called, build their animal vocabulary, and start to develop word and picture association.

Designed in Roger Priddy's classic, timeless format, this book has enduring appeal and educational value that sustains fun, stimulating reading, again and again.",3-6 tuổi
My big rig,https://lotuscommunity.org.vn/wp-content/uploads/2022/10/My-big-rig.jpg,3-5,012,Jonathan London,Sách truyện thiếu nhi,3-6 tuổi,Two Lions,"Zoom! While playing with his toy truck, a little boy imagines himself driving an eighteen-wheeler through a city, across a bridge, and into the countryside. Along the way, he uses his two-way radio and parks at a truck stop. Finally, he reaches the coast, where he unloads his cargo. His imagination would keep growing but... it’s time for dinner!",3-6 tuổi
My first 1000 words,https://lotuscommunity.org.vn/wp-content/uploads/2022/10/My-first-1000-words.jpg,3-5,020,PHP,Sách truyện thiếu nhi,3-6 tuổi,Award Publications Ltd,"Featuring 1000 essential first words, all illustrated in full colour and thematically grouped to aid vocabulary building and retention, this is a key title for early learning.
Children will love studying the busy scenes, and finding pictures to match the words in this fun and educational title.",3-6 tuổi
My first book of words,https://lotuscommunity.org.vn/wp-content/uploads/2022/10/My-first-book-of-words.jpg,3-5,009,The Book Company,Sách truyện thiếu nhi,3-6 tuổi,JG Kids ,"Learning comes to life with vivid photographs featuring playtime, mealtime, and more, helping children find the right words for the objects they see in everyday life. The cushioned cover of the board book and sturdy handle make the book fun to carry along for on-the-go engagement.",3-6 tuổi
My little book of farm stories,https://lotuscommunity.org.vn/wp-content/uploads/2022/10/My-little-book-of-farm-stories.jpg,7-2,071,Brown Watson,Sách truyện thiếu nhi,7-9 tuổi,Brown & Watson,"Farm stories suitable for children of all ages, beautifully illustrated with clear text allowing children to easily follow along.",7-9 tuổi
My phonics readers: Pat Cat and Tat Rat,https://lotuscommunity.org.vn/wp-content/uploads/2022/10/My-phonics-readers-Pat-Cat-and-Tat-Rat.jpg,3-5,007,Si Yiah Ling,Sách truyện thiếu nhi,3-6 tuổi,Penerbitan Pelangi,"Children who are taught the skills of decoding words through sounding out letters and letter combinations tend to be better readers. 
These twelve little graded readers can be used on their own, or as follow-up reading material to our very well-received preschool phonics programme under the “My Preschool World” series.
With captivating illustrations and easy-to-read text, this set of books will soon put children on the road to reading success.
",3-6 tuổi
Nicolai writes lovely things,https://lotuscommunity.org.vn/wp-content/uploads/2022/10/Nicolai-writes-lovely-things.jpg,7-5,073,Nuria Roca,Sách truyện thiếu nhi,7-9 tuổi,Gemser Publications,"What Nicoai likes best are tales, stories, books, words and sentences. Lola wants to be a writer, but in order to become one, she has to work a lot. Because words are never ending, stories are infinite and the imagination is always inventing something. Lola is like a lion tamer of words! And in the end, when she knows what to do with them, she will be able to invent as many imaginary worlds as she likes!",7-9 tuổi
"No tooth, no quarter",https://lotuscommunity.org.vn/wp-content/uploads/2022/10/No-tooth-no-quarter.jpg,7-5,070,Jon Buller,Sách truyện thiếu nhi,7-9 tuổi,Random House,"Poor Walter has not only lost a tooth, he's also managed to lose his lost tooth. His chances of getting his quarter look slim, and the apprentice tooth fairy assigned to pick up the tooth is in hot water in this imaginative romp for young readers.  ",7-9 tuổi
Ocean life,https://lotuscommunity.org.vn/wp-content/uploads/2022/10/Ocean-life.jpg,23-2,082,Brenda Z. Guiberson,Sách tham khảo,Động vật,Scholastic,"An overview of sharks, whales, and dolphins, covering their physical characteristics, diets, and behavior. Includes a glossary.",Động vật
Peppa Pig: little creatures,https://lotuscommunity.org.vn/wp-content/uploads/2022/10/Peppa-Pig-little-creatures.jpg,3-5,017,Ladybird,Sách truyện thiếu nhi,3-6 tuổi,"Ladybird Books
","There are many interesting little creatures in Grandpa Pig's garden for Peppa, George and their friends to learn about, including snails with their little houses and bees making honey!Read it yourself with Ladybird is one of Ladybird's best-selling series. For over thirty-five years it has helped young children who are learning to read develop and improve their reading skills.Each Read it yourself book is very carefully written to include many key, high-frequency words that are vital for learning to read, as well as a limited number of story words that are introduced and practised throughout. Simple sentences and frequently repeated words help to build the confidence of beginner readers and the four different levels of books support children all the way from very first reading practice through to independent, fluent reading.Each book has been carefully checked by educational consultants and can be read independently at home or used in a guided reading session at school. Further content includes comprehension puzzles, helpful notes for parents, carers and teachers, and book band information for use in schools.Peppa Pig: Little Creatures is a Level 1 Read it yourself title, suitable for very 7-9 tuổi who have had some initial reading instruction and are ready to take their first steps in reading real stories. Each story is told very simply, using a small number of frequently repeated words.",3-6 tuổi
Peppa Pig: nature trail,https://lotuscommunity.org.vn/wp-content/uploads/2022/10/Peppa-Pig-nature-trail.jpg,3-5,018,Ladybird,Sách truyện thiếu nhi,3-6 tuổi,"Ladybird Books
","Peppa Pig and her family are enjoying a nature walk when they get lost. Can Peppa, George, Mummy Pig and Daddy Pig get safely back to the car for their lunch?Read it yourself with Ladybird is one of Ladybird's best-selling series. For over thirty-five years it has helped young children who are learning to read develop and improve their reading skills.Each Read it yourself book is very carefully written to include many key, high-frequency words that are vital for learning to read, as well as a limited number of story words that are introduced and practised throughout. Simple sentences and frequently repeated words help to build the confidence of beginner readers and the four different levels of books support children all the way from very first reading practice through to independent, fluent reading.Each book has been carefully checked by educational consultants and can be read independently at home or used in a guided reading session at school. Further content includes comprehension puzzles, helpful notes for parents, carers and teachers, and book band information for use in schools.Peppa Pig: Nature Trail is a Level 2 Read it yourself title, ideal for children who have received some initial reading instruction and can read short, simple sentences with help.",3-6 tuổi
Peppa Pig: sports day,https://lotuscommunity.org.vn/wp-content/uploads/2022/10/Peppa-Pig-sports-day.jpg,3-5,019,Ladybird,Sách truyện thiếu nhi,3-6 tuổi,"Ladybird Books
","Peppa, George and their friends were at Sports Day. But Peppa started slowly and George could not jump!",3-6 tuổi
Phineas and Ferb: speed demons,https://lotuscommunity.org.vn/wp-content/uploads/2022/10/Phineas-and-Ferb-speed-demons.jpg,21-2,063,Disney,Sách truyện thiếu nhi,10-12 tuổi,Disney Press,Lazy summer days? Not for Phineas and Ferb. One day the duo fixes up their mom’s car and takes it to the races. The next they build the world’s craziest roller coaster! The neighborhood’s not likely to be the same after this. But will Dr. Doofenshmirtz’s plan to reverse the spin of the earth with a magnet trained at the eastern seaboard succeed and ruin things for everyone?,10-12 tuổi
Pinky and Rex and the new baby,https://lotuscommunity.org.vn/wp-content/uploads/2022/10/Pinky-and-Rex-and-the-new-baby.jpg,7-5,067,James Howe,Sách truyện thiếu nhi,7-9 tuổi,Simon Spotlight,"Rex's parents are adopting a baby, and Rex doesn't like the idea at all. Suppose her parents are so busy with the new baby they forget about her?
So she comes up with a plan. If she can be the perfect big sister, her parents will have to pay attention to her. The trouble is, being the perfect big sister is a lot of work, and it doesn't leave time for much else - like her best friend, Pinky.",7-9 tuổi
Pinky and Rex and the perfect pumpkin,https://lotuscommunity.org.vn/wp-content/uploads/2022/10/Pinky-and-Rex-and-the-perfect-pumpkin.jpg,7-5,068,James Howe,Sách truyện thiếu nhi,7-9 tuổi,Simon Spotlight,"When Rex is invited to go along on the traditional pumpkin-picking trip with Pinky's grandparents, she doesn't feel that Pinky's cousin Abby really wants her to be part of the fun.",7-9 tuổi
Planet pop-up: monkey on the moon,https://lotuscommunity.org.vn/wp-content/uploads/2022/10/Planet-pop-up-monkey-on-the-moon.jpg,3-5,022,Jonathan Litton,Sách truyện thiếu nhi,3-6 tuổi,Silver Dolphin Books,"The goofy animals of Monkey on the Moon are having a blast as they explore outer space in this rhyming pop-up book. Open up the pages to discover a moonwalking monkey, a space-surfing crocodile, and other super-fantastic, intergalactic creatures in orbit! The animals’ antics will bring smiles to the faces of young readers, and the colorful, high-quality interactive pop-ups with moving elements will entertain for hours on end.",3-6 tuổi
